user_input,retrieved_contexts,response,reference,context_recall,context_precision,faithfulness,answer_correctness,answer_relevancy,question_id,_pred_letter,_gold_letter,_is_correct,_has_context
"A 12-year-old boy who recently immigrated from Namibia is being evaluated for exertional shortness of breath and joint pain for the past month. His mother reports that he used to play soccer but now is unable to finish a game before he runs out of air or begins to complain of knee pain. He was a good student but his grades have recently been declining over the past few months. The mother recalls that he had a sore throat and didn’t go to school for 3 days a few months ago. He had chickenpox at the age of 5 and suffers from recurrent rhinitis. He is currently taking over-the-counter multivitamins. His blood pressure is 110/90 mm Hg, pulse rate is 55/min, and respiratory rate is 12/min. On physical examination, subcutaneous nodules are noted on his elbows bilaterally. On cardiac auscultation, a holosystolic murmur is heard over the mitral area that is localized. Lab work shows:
Hemoglobin 12.9 g/dL
Hematocrit 37.7%
Leukocyte count 5,500/mm3
Neutrophils 65%
Lymphocytes 30%
Monocytes 5%
Mean corpuscular volume 82.2 fL
Platelet count 139,000/mm3
Erythrocyte sedimentation rate 35 mm/h
C-reactive protein 14 mg/dL
Antistreptolysin O (ASO) 400 IU (normal range: > 200 IU)
Which is the mechanism behind the cause of this boy’s symptoms?","['Systemic symptoms and signs aside from fever are infrequent and depend mainly on the more mundane effects of the invading virus; these include sore throat, nausea and vomiting, vague weakness, pain in the back and neck, conjunctivitis, cough, diarrhea, vomiting, rash, petechia, hepatitis, adenopathy, or splenomegaly. The childhood exanthems associated with meningitis and encephalitis (varicella, rubella, mumps) produce well-known eruptions and other characteristic signs. An erythematous papulomacular, nonpruritic rash, confined to the head and neck or generalized, may also be a prominent feature, particularly in children, of certain echoviruses and Coxsackie viruses. Adults may also demonstrate a nonspecific rash but this finding is not specific. An enanthem (herpangina), taking the form of a vesiculoulcerative eruption of the buccal mucosa, may also occur with these viral infections.\n\nIn milder cases, in the first hours or day of the illness, there may be no abnormalities of the spinal fluid, and the patient may erroneously be thought to have migraine or a headache induced by a systemic infectious illness. Microorganisms cannot be demonstrated by conventional smear or culture but may be detected by polymerase chain reaction, the last of these techniques being employed largely in cryptic cases. As a rule, the glucose content of the CSF is normal; but infrequently, mild depression of the CSF glucose (rarely below 25 mg/dL) occurs with the meningitis caused by mumps, HSV-2, lymphocytic choriomeningitis, or VZV.', 'Children with shortened erythrocyte life span (e.g., sickle cell disease) may develop a transient aplastic crisis characterized by ineffective erythroid production typically lasting 7 to 10 days (see Chapter 150). Most children with parvovirus B19-induced transient aplastic crisis have multiple symptoms, including fever, lethargy, malaise, pallor, headache, gastrointestinal symptoms, and respiratory symptoms. The reticulocyte count is extremely low, and the hemoglobin level is lower than usual for the patient. Transient neutropenia and thrombocytopenia also commonly occur.\n\nPersistent parvovirus B19 infection may develop in children with immunodeficiency, causing severe anemia resulting from pure red blood cell aplasia. These children do not display the typical manifestations of erythema infectiosum.\n\nHematologic abnormalities occur with parvovirus infection, including reticulocytopenia lasting 7 to 10 days, mild anemia, thrombocytopenia, lymphopenia, and neutropenia. Parvovirus B19 can be detected by PCR and by electron microscopy of erythroid precursors in the bone marrow. Serologic tests showing specific IgM antibody to parvovirus are diagnostic, demonstrating infection that probably occurred in the prior 2 to 4 months.\n\nThe diagnosis of erythema infectiosum in children is established on the basis of the clinical findings of typical facial rash with absent or mild prodromal symptoms, followed by a reticulated rash over the body that waxes and wanes. The differential diagnosis includes measles, rubella, scarlet fever, enteroviral or adenoviral infection, infectious mononucleosis, scarlet fever, Kawasaki disease, systemic lupus erythematosus, serum sickness, and drug reaction.', 'Fever (usually > 40°C) for at least f ve days.\n\nBilateral, nonexudative, painless conjunctivitis sparing the limbic area.\n\nPolymorphous rash (primarily truncal).\n\nCervical lymphadenopathy (often painful and unilateral, with at least one node > 1.5 cm).\n\nDiffuse mucous membrane erythema (e.g., “strawberry tongue”); dry, red, chapped lips.\n\nErythema of the palms and soles; indurative edema of the hands and feet; late desquamation of the fingertips (in the subacute phase).\n\nOther manifestations include sterile pyuria, gallbladder hydrops, hepatitis, and arthritis.\n\nUntreated Kawasaki disease can lead to coronary aneurysms and even myocardial infarction!\n\nConjunctivitis Rash Adenopathy Strawberry tongue Hands and feet (red, swollen, f aky skin) BURN (fever > 40°C for ≥ 5 days)\n\nSubacute phase: Begins after the abatement of fever and typically lasts for an additional 2–3 weeks. Manifestations are thrombocytosis and elevated ESR. Untreated children may begin to develop coronary artery aneurysms (40%); all patients should be assessed by echocardiography at diagnosis.\n\nChronic phase: Begins when all clinical symptoms have disappeared; lasts until ESR returns to baseline. Untreated children are at risk of aneurysmal expansion and MI.\n\nHigh-dose ASA (for inﬂammation and fever) and IVIG (to prevent aneurysms).\n\nLow-dose ASA is then continued, usually for six weeks. Children who develop coronary aneurysms may require chronic anticoagulation with ASA or other antiplatelet medications.', 'The history can identify symptoms that reflect the source of the inflammation, including whether it is localized or systemic. Symptoms of systemic inflammation tend to be nonspecific. Fever, caused by cytokine release, can take many forms. A hectic fever, without periodicity or pattern, is commonly found in vasculitides such as Kawasaki disease but also occurs in children with underlying infection. Certain illnesses, such as systemic-onset JIA, produce a patterned fever with regular temperature spikes once or twice a day. Other rheumatic illnesses cause low-grade fevers. Charting the child’s fever pattern, particularly in the absence of antipyretics, is useful. Rashes occur in many forms (see Table 86-1). Other systemic symptoms (malaise, anorexia, weight loss, and fatigue) can vary from mild to debilitating.\n\nSymptoms of localized inflammation vary depending on the involved site. Arthritis, or inflammation of the synovium (synovitis), leads to joint pain, swelling, and impaired ability to use the affected joint. Morning stiffness or gelling is described. The child may be slow to arise in the morning and may have a limp. Children may refrain from usual activities and athletics. Enthesitis is inflammation at the insertion of a ligament to a bone. Serositis, inflammation of serosal lining such as pleuritis, pericarditis, or peritonitis, gives rise to chest pain, shortness of breath, or abdominal pain. Myositis,inflammation of the muscle, may lead to symptoms of muscle pain, weakness, or difficulty performing tasks of daily living. Vasculitis, inflammation of the blood vessels, leads to nonspecific symptoms of rash (petechiae, purpura) and edema when small vessels deep in the papillary dermis are involved; involvement of medium-sized vessels results in a circumscribed tender nodule.', 'Compared with classic streptococcal pharyngitis, the onset of viral pharyngitis is typically more gradual, and symptoms more often include rhinorrhea, cough, and diarrhea. Many upper respiratory tract infections present with symptoms of rhinorrhea and nasal obstruction, whereas systemic symptoms and signs, such as myalgia and fever, are absent or mild.\n\nGingivostomatitis is characteristic of herpes simplex virus-1 (see Chapter 65). Herpangina is an enteroviral infection with sudden onset of high fever, vomiting, headache, malaise, myalgia, backache, conjunctivitis, poor intake, drooling, sore throat,and dysphagia. The oral lesions of herpangina may be nonspecific, but classically there are one or more small, tender, papular,or pinpoint vesicular lesions on an erythematous base scatteredover the soft palate, uvula, and tongue. These vesicles enlargefrom 1 to 2 mm to 3 to 4 mm over 3 to 4 days, rupture, and produce small, punched-out ulcers that persist for several days.\n\nThe principal challenge is to distinguish pharyngitis caused by group A streptococcus from pharyngitis caused by nonstreptococcal (usually viral) organisms. A rapid streptococcal antigen test, a throat culture, or both are often performed to improve diagnostic precision and to identify children most likely to benefit from antibiotic therapy of streptococcal disease.\n\nMany rapid diagnostic techniques for streptococcal pharyngitis are available with excellent specificity of 95% to 99%. The sensitivity of these rapid tests varies, however, and negative rapid tests should be confirmed by a throat culture.', 'The most widely accepted theory of rheumatic fever pathogenesis is based on the concept of molecular mimicry, whereby an immune response targeted at streptococcal antigens (mainly thought to be on the M protein and the N-acetylglucosamine of group A streptococcal carbohydrate) also recognizes human tissues. In this model, cross-reactive antibodies bind to endothelial cells on the heart valve, leading to activation of the adhesion molecule VCAM-1, with resulting recruitment of activated lymphocytes and lysis of endothelial cells in the presence of complement. The latter leads to release of peptides including laminin, keratin, and tropomyosin, which, in turn, activates cross-reactive T cells that invade the heart, amplifying the damage and causing epitope spreading. An alternative hypothesis proposes that the initial damage is due to streptococcal invasion of epithelial surfaces, with binding of M protein to type IV collagen RHD allowing it to become immunogenic, but not through the mechanism of molecular mimicry.\n\nThere is a latent period of ~3 weeks (1–5 weeks) between the precipitating group A streptococcal infection and the appearance of the clinical features of ARF. The exceptions are chorea and indolent carditis, which may follow prolonged latent periods lasting up to 6 months. Although many patients report a prior sore throat, the preceding group A streptococcal infection is commonly subclinical; in these cases, it can only be confirmed using streptococcal antibody testing. The most common clinical features are polyarthritis (present in 60–75% of cases) and carditis (50–60%). The prevalence of chorea in ARF varies substantially between populations, ranging from <2 to 30%. Erythema marginatum and subcutaneous nodules are now rare, being found in <5% of cases.', 'The valvular disease principally takes the form of deforming fibrotic mitral stenosis; indeed rheumatic heart disease is essentially the only cause of acquired mitral stenosis. The incidence of rheumatic fever (and thus rheumatic heart disease) has declined remarkably in many parts of the Western world over the past several decades due to a combination of improved socioeconomic conditions, rapid diagnosis and treatment of streptococcal pharyngitis, and a fortuitous (and unexplained) decline in the virulence of many strains of group A streptococci. Nevertheless, in developing countries and economically depressed urban areas in the United States, rheumatic fever and rheumatic heart disease remain important public health problems.\n\nAcute rheumatic fever is a hypersensitivity reaction classically attributed to antibodies directed against group A streptococcal molecules that cross-react with host myocardial antigens (see also Chapter 5). In particular, antibodies against M proteins of certain streptococcal strains bind to proteins in the myocardium and cardiac valves and cause injury through the activation of complement and Fc receptor–bearing cells (including macrophages). CD4+ T cells that recognize streptococcal peptides can cross-react with host antigens and elicit cytokine-mediated inflammatory responses. The characteristic 2-to 3-week delay in symptom onset after infection is explained by the time needed to generate an immune response; streptococci are completely absent from the lesions. Since only a small minority of infected patients develop rheumatic fever (estimated at 3%), genetic susceptibility to the development of the cross-reactive immune responses is likely in those affected. The deforming fibrotic lesions are the predictable consequence of healing and scarring associated with the resolution of the acute inflammation.', 'Available @ StudentConsult.com\n\nAcute rheumatic fever is diagnosed using the clinical and laboratory findings of the revised Jones criteria (Table 146-1).The presence of either two major criteria or one major and two minor criteria, along with evidence of an antecedent streptococcal infection, confirm a diagnosis of acute rheumatic fever. The infection often precedes the presentation of rheumatic fever by 2 to 6 weeks. Streptococcal antibody tests, such as the antistreptolysin O titer, are the most reliable laboratory evidence of prior infection.\n\nTable 146-1 Major Jones Criteria for Diagnosis of Acute Rheumatic Fever*,†\n\nPolyarthritis Common; swelling, limited motion, tender, erythema Migratory; involves large joints but rarely small or unusual joints, such as vertebrae\n\nCarditis Common; pancarditis, valves, pericardium, myocardium\n\nTachycardia greater than explained by fever; new murmur of mitral or aortic insufficiency; Carey-Coombs mid-diastolic murmur; heart failure marginatum proximal extremities, evolving to serpiginous border with central clearing; evanescent, elicited by application of local heat; nonpruritic\n\nSubcutaneous Uncommon; associated with repeated nodules episodes and severe carditis; located over extensor surface of elbows, knees, knuckles, and ankles or scalp and spine; firm, nontender *Minor criteria include fever (temperatures of 101°–102°F [38.2°–38.9°C]), arthralgias, previous rheumatic fever, leukocytosis, elevated erythrocyte sedimentation rate/C-reactive protein, and prolonged PR interval.', 'Primary episode of rheumatic fevera Two major or one major and two\n\nRecurrent attack of rheumatic fever in Two major or one major and two matic heart disease of preceding group A streptococcal\n\nRecurrent attack of rheumatic fever in Two minor manifestations plus evia patient with established rheumatic dence of preceding group A streptoheart diseaseb coccal infectionc\n\nRheumatic chorea Other major manifestations or evidence of group A streptococcal\n\nChronic valve lesions of rheumatic Do not require any other criteria to heart disease (patients presenting for be diagnosed as having rheumatic the first time with pure mitral steno-heart disease sis or mixed mitral valve disease and/ or aortic valve disease)d\n\nMinor manifestations Clinical: fever, polyarthralgia\n\nLaboratory: elevated erythrocyte sedimentation rate or leukocyte counte\n\nElectrocardiogram: prolonged P-R interval\n\nSupporting evidence of a preceding Elevated or rising anti-streptolysin streptococcal infection within the last O or other streptococcal antibody, or 45 days\n\nA positive throat culture, or', 'Management of acute rheumatic fever consists of benzathine penicillin to eradicate the beta-hemolytic streptococcus, anti-inflammatory therapy with salicylates, and bed rest. Additional supportive therapy for heart failure or chorea may be necessary. Longterm penicillin prophylaxis, preferably with intramuscular benzathine penicillin G, 1.2 million U every 28 days, is required. Oral regimens for prophylaxis generally are not as effective. The prognosis of acute rheumatic fever depends on the degree of permanent cardiac damage. Cardiac involvement may resolve completely, especially if it is the first episode and the prophylactic regimen is followed. The severity of cardiac involvement worsens with each recurrence of rheumatic fever.\n\nA cardiomyopathy is an intrinsic disease of the heart muscle and is not associated with other forms of heart disease (Table 147-1). There are three types of cardiomyopathy based on anatomic and functional features: 1.\n\n2.\n\n3.\n\nDilated cardiomyopathies are the most common. They are often idiopathic, but may be due to infection (echovirus or Coxsackie B virus) or be postinfectious, familial, or secondary to systemic disease or to cardiotoxic drugs. Hypertrophic cardiomyopathies are usually familial with autosomal dominant inheritance, but may occur sporadically. Restrictive cardiomyopathies are rare; they may be idiopathic or associated with systemic disease (Table 147-2).\n\nAvailable @ StudentConsult.com', 'Up to 60% of patients with ARF progress to RHD. The endocardium, pericardium, or myocardium may be affected. Valvular damage is the hallmark of rheumatic carditis. The mitral valve is almost always\n\nFIGUrE 381-2 Transthoracic echocardiographic image from a 5-year-old boy with chronic rheumatic heart disease. This diastolic image demonstrates leaflet thickening, restriction of the anterior mitral valve leaflet tip and doming of the body of the leaflet toward the inter-ventricular septum. This appearance (marked by the arrowhead) is commonly described as a “hockey stick” or an “elbow” deformity. AV, aortic valve; LA, left atrium; LV, left ventricle; MV, mitral valve; RV, right ventricle. (Courtesy of Dr. Bo Remenyi, Department of Paediatric and Congenital Cardiac Services, Starship Children’s Hospital, Auckland, New Zealand.) affected, sometimes together with the aortic valve; isolated aortic valve involvement is rare. Damage to the pulmonary or tricuspid valves is usually secondary to increased pulmonary pressures resulting from left-sided valvular disease. Early valvular damage leads to regurgitation. Over ensuing years, usually as a result of recurrent episodes, leaflet thickening, scarring, calcification, and valvular stenosis may develop (Fig. 381-2). See Videos 381-1 and 381-2 on the DVD. Therefore, the characteristic manifestation of carditis in previously unaffected individuals is mitral regurgitation, sometimes accompanied by aortic regurgitation. Myocardial inflammation may affect electrical conduction pathways, leading to P-R interval prolongation (first-degree atrioventricular block or rarely higher level block) and softening of the first heart sound.', 'Huang JB, Liu YL, Sun PW, et al: Molecular mechanisms of congenital heart disease, Cardiovasc Pathol 19:e183, 2010. [A comprehensive review of the genes and pathways underlying congenital heart disease.]\n\nLi C, Xu S, Gotlieb AI: The response to valve injury. A paradigm to understand the pathogenesis of heart valve disease, Cardiovasc Pathol 20:183, 2011. [A nice overview of pathologic concepts in valvular disease.]\n\nMann DL, Zipes DP, Libby P, et al, editors: Braunwald’s heart disease: a textbook of cardiovascular medicine, ed 10, Philadelphia, 2015, Else-vier. [An outstanding and authoritative text, with excellent sections on heart failure and atherosclerotic cardiovascular disease.]\n\nMaron BJ, Towbin JA, Thiene G, et al: Contemporary definitions and classification of the cardiomyopathies: an American Heart Association Scientific Statement from the Council on Clinical Cardiology, Heart Failure and Transplantation Committee; Quality of Care and Outcomes Research and Functional Genomics and Translational Biology Interdisciplinary Working Groups; and Council on Epidemiology and Prevention, Circulation 113:1807, 2006. [A consensus document regarding an updated classification of cardiomyopathies, heavily weighted to genetic etiologies rather than pathophysiologic manifestations.]\n\nMitchell RN: Graft vascular disease: immune response meets the vessel wall, Annu Rev Pathol 4:19, 2009. [A comprehensive overview of allograft arteriopathy, including animal models, pathogenic mechanisms, clinical diagnosis, and therapy.]', '. Rheumatic disease causes fibrous infiltration of the valve cusps and subsequent retraction of the valve leaflets, inhibiting apposition of the cusps during diastole and producing a central regurgitant jet. Patients with large ventricular septal defects or membranous subaortic stenosis may develop progressive AI, owing to a Venturi effect that results in prolapse of the aortic valve leaflets.Pathophysiology.\u2002The basic pathophysiologic abnormality of AI is the retrograde flow of a portion of the LV stroke volume into the LV during diastole, producing volume overload.Acute severe AI results most commonly from infective endocarditis, acute aortic dissection, or trauma, and it causes a sudden volume overload of the left ventricle.54 Although an acute increase in preload provides a small increase in overall Brunicardi_Ch21_p0801-p0852.indd   82601/03/19   5:32 PM 827ACQUIRED HEART DISEASECHAPTER 21stroke volume due to the Starling mechanism, the left ventricle often is unable to accommodate the large regurgitant volume and maintain forward stroke volume in the acute setting due to a lack of remodeling. Left ventricular end-diastolic and left atrial pressures increase dramatically as the LV is unable to develop compensatory chamber dilation. Although tachycardia develops as a compensatory mechanism to maintain forward flow, this attempt is often inadequate, and patients frequently present in heart failure and even cardiogenic shock. Moreover, subendo-cardial myocardial ischemia frequently develops as a result of decreased coronary diastolic perfusion pressures and increased LV end-diastolic pressure, as well as increased myocardial oxy-gen demand due to acute dilation', 'Patrick T. O’Gara, Joseph Loscalzo\n\nPrimary valvular heart disease ranks well below coronary heart disease, stroke, hypertension, obesity, and diabetes as a major threat to the public health. Nevertheless, it is the source of significant morbidity and mortality rates. Rheumatic fever (Chap. 381) is the dominant cause of valvular heart disease in developing and low-income countries. Its prevalence has been estimated to range from as low as 1 per 100,000 school-age children in Costa Rica to as high as 150 per 100,000 in China. Rheumatic heart disease accounts for 12–65% of hospital admissions related to cardiovascular disease and 2–10% of hospital discharges in some developing countries. Prevalence and mortality rates vary among communities even within the same country as a function of overcrowding and the availability of medical resources and population-wide programs for detection and treatment of group A streptococcal pharyngitis. In economically deprived areas, tropical and subtropical climates (particularly on the Indian subcontinent), Central\n\nAmerica, and the Middle East, rheumatic valvular disease progresses more rapidly than in more-developed nations and frequently causes serious symptoms in patients younger than 20 years of age. This accelerated natural history may be due to repeated infections with more virulent strains of rheumatogenic streptococci. Approximately 15 million to 20 million people live with rheumatic heart disease worldwide, an estimated prevalence characterized by 300,000 new cases and 233,000 case fatalities per year, with the highest mortality rates reported from Southeast Asia (~7.6 per 100,000).']",Type III hypersensitivity reaction,Type II hypersensitivity reaction,1.0,0.22619047617916663,0.0,0.6379371188611758,0.5919247484631222,golden_000,C,B,False,True
A 55-year-old woman with a 1-year history of left-sided tinnitus is diagnosed with a tumor of the left jugular fossa. Sialometry shows decreased production of saliva from the left parotid gland. The finding on sialometry is best explained by a lesion of the nerve that is also responsible for which of the following?,"['A primary brainstem lesion affecting the motor nucleus of the facial nerve [VII] would lead to ipsilateral (same side) weakness of the whole face. However, because the upper part of the nucleus receives motor input from the left and right cerebral hemispheres a lesion occurring above the nucleus leads to contralateral lower facial weakness. In this example, motor innervation to the upper face is spared because the upper part of the nucleus receives input from both hemispheres. Preservation and loss of the special functions are determined by the extent of the lesion.\n\nLesions at and around the geniculate ganglion\n\nTypically lesions at and around the geniculate ganglion are accompanied by loss of motor function on the whole of the ipsilateral (same) side of the face. Taste to the anterior two-thirds of the tongue, lacrimation, and some salivation also are likely to be affected because the lesion is proximal to the greater petrosal and chorda tympani branches of the nerve.\n\nLesions at and around the stylomastoid foramen\n\nLesions at and around the stylomastoid foramen are the commonest abnormality of the facial nerve [VII] and usually result from a viral inflammation of the nerve within the bony canal before exiting through the stylomastoid foramen. Typically the patient has an ipsilateral loss of motor function of the whole side of the face. Not only does this produce an unusual appearance, but it also complicates chewing of food. Lacrimation and taste may not be affected if the lesion remains distal to the greater petrosal and chorda tympani branches that originate deep in the temporal bone.\n\nIn the clinic', '. As previously mentioned, minor salivary gland malignancies can present anywhere in the upper aerodigestive tract, particularly on the palate; however, the major salivary glands are the parotid, submandibular, and sublingual glands. The majority of tumors (80%) arise in the parotid gland (Fig. 18-44); however, 80% of these are benign, most commonly, pleomorphic adenomas (benign mixed tumors). As the salivary gland gets smaller, the proportion of tumors that are malignant increases; 50% of sub-mandibular/sublingual tumors and 80% of minor salivary gland tumors are malignant.Patients typically present with a mass because these tumors are well circumscribed and slow growing. However, certain signs and symptoms, such as pain, paresthesia, facial nerve weakness, or rapid growth, raise the concern for malig-nancy. If there is facial nerve weakness (10%–15% of cases), this usually represents tumor invading the facial nerve. Sub-mandibular and sublingual tumors present with a mass or swell-ing in the neck or floor of the mouth, respectively. Tumors in this region can invade the lingual nerve leading to tongue par-esthesia or the hypoglossal nerve invasion leading to paralysis. The close proximity to the mandible and tongue necessitates a thorough bimanual palpation to assess for fixation to these structures.The decision to dissect the neck in parotid cancers is fraught with uncertainty. However, parotid malignancies, par-ticularly carcinomas, have a propensity for regional lymphatic spread, first to the intraand periglandular nodes followed by the upper cervical chain (levels I–III)', 'The patient consented for removal of the parotid gland and a discussion of the possibility for loss of facial function and facial paralysis was had with the patient at this time.\n\nWithin the parotid gland the facial nerve [VII] divides into its five terminal branches. At operation the gland is displayed and extremely careful dissection is necessary to peel away the parotid gland from the branches of the facial nerve [VII]. This procedure was made more difficult by the chronic inflammatory change within the gland. After the procedure the patient made a good recovery, though there was some mild paralysis of the whole of the right side of the face. Importantly, taste to the anterior two-thirds of the tongue was preserved. The taste fibers to the anterior two-thirds of the tongue travel in the chorda tympani nerve, which is a branch of the facial nerve [VII]. This nerve leaves the facial nerve [VII] to join the lingual nerve proximal to the parotid gland; therefore, any damage to the facial nerve [VII] within the parotid gland does not affect special sensation (taste).\n\nOver the following week the paralysis improved and was likely due to nerve bruising during the procedure. The patient remained asymptomatic.\n\nA 60-year-old woman was brought to the emergency department with acute right-sided weakness, predominantly in the upper limb, which lasted for 24 hours. She made an uneventful recovery, but was extremely concerned about the nature of her illness and went to see her local doctor.\n\nA diagnosis of a transient ischemic attack (TIA) was made.\n\nA TIA is a neurological deficit resolving within 24 hours. It is a type of stroke.\n\nNeurological deficits may be permanent or transient. Most transient events resolve within 21 days; any failure of resolution beyond 21 days is an established stroke.\n\nAn investigation into the cause of the TIA was undertaken.', 'Laryngeal neuralgia is a rare entity in which paroxysms of pain are localized over the upper portion of the thyroid cartilage or hyoid bone on one or both sides. The pain may be evoked by coughing, yawning, talking, or sneezing. In the case reported by Brownstone and coworkers, the symptoms were relieved by carbamazepine.\n\nNeurologic Diagnosis of Vocal Cord Paralysis\n\nClues from the history and examination can help determine the site of the lesion producing vocal cord palsy. If intramedullary, there are usually ipsilateral cerebellar signs, loss of pain and temperature sensation over the ipsilateral face and contralateral arm and leg, and an ipsilateral Bernard-Horner syndrome (see Table 33-3). If the lesion is extramedullary but intracranial, the glossopharyngeal and spinal accessory nerves are frequently involved as well (jugular foramen syndrome; see Table 44-1).\n\nIf extracranial in the posterior lateral condylar or retroparotid space, there may be a combination of ninth, tenth, eleventh, and twelfth cranial nerve palsies and a Horner syndrome. Combinations of these lower cranial nerve palsies, which have a variety of eponymic designations (see Table 44-1) are caused by various tumors, both primary and metastatic, or by chronic inflammations or granulomas involving lymph nodes at the base of the skull. If there is no palatal weakness and no pharyngeal or palatal sensory loss, the lesion is below the origin of the pharyngeal branches, which leaves the vagus nerve high in the cervical region. The usual site of disease is then the mediastinum.\n\nThe Eleventh, or Spinal Accessory, Nerve', '. The differential diagnosis for parapharyngeal masses is very much dependent on the anatomy and contents of this space which is divided into the preand poststyloid spaces by the tensor-styloid fascia. This fascia attaches the tensor veli palatini muscle to the styloid. The contents of the prestyloid parapharyngeal space include fat, the deep lobe of the parotid, and lymph nodes, and branches of V3 (lingual, inferior alveo-lus, and auriculotemporal nerves), whereas the contents of the poststyloid space including cranial nerves IX to XII, the inter-nal jugular vein, the internal carotid artery, and the sympathetic chain. Nearly half of all parapharyngeal masses are of parotid origin, while 20% to 25% are of neurogenic origin, such as paragangliomas (glomus vagale, carotid body tumor), schwan-nomas, and neurofibromas. Lymphatic origin masses such as lymphoma and lymph node metastases represent 15% of tumors at this subsite. Therefore, most prestyloid lesions are considered of salivary gland origin, whereas poststyloid lesions are typi-cally vascular or neurogenic.Tumors of the parapharyngeal space can displace the lat-eral pharyngeal wall medially into the oropharynx (Fig. 18-41) and can thus cause obstructive sleep apnea, voice change, and dysphagia in addition to cranial neuropathies, Horner’s syn-drome, or vascular compression', 'It is commonly stated that the glossopharyngeal nerve mediates sensory impulses from the faucial tonsils, posterior wall of the pharynx, and part of the soft palate as well as taste sensation from the posterior third of the tongue. However, an isolated lesion of the ninth cranial nerve is a rarity and therefore the effects are not fully known. In one personally observed case of bilateral surgical interruption of the ninth nerves, verified at autopsy, there had been no demonstrable loss of taste or other sensory or motor impairment. This suggests that the tenth nerve may be responsible for these functions, at least in some individuals. The role of the ninth nerve in the reflex control of blood pressure and ventilation has been alluded to earlier but referable clinical manifestations from damage of this cranial nerve are infrequent except perhaps for syncope as noted below.\n\nOne may occasionally observe glossopharyngeal palsy in conjunction with vagus and accessory nerve involvement because of a tumor in the posterior fossa or an aneurysm or intracranial dissection of the vertebral artery, or thrombosis of the sigmoid sinus or internal jugular vein. The nerves may be compressed as they pass through the jugular foramen. Hoarseness as a result of vocal cord paralysis, some difficulty in swallowing, deviation of the soft palate to the sound side, anesthesia of the posterior wall of the pharynx, and weakness of the upper trapezius and sternomastoid muscles make up the clinical picture (see Table 44-1, jugular foramen syndrome). On leaving the skull, the ninth, tenth, and eleventh nerves lie adjacent to the cervical internal carotid artery, where they can be damaged (presumably made ischemic) by a dissection of that vessel.\n\nGlossopharyngeal Neuralgia (Also Discussed in Chap. 9)', 'Within or immediately outside the jugular foramen are two ganglia (the superior and inferior ganglia), which contain the cell bodies of the sensory neurons in the glossopharyngeal nerve [IX].\n\nBranching from the glossopharyngeal nerve [IX] either within or immediately outside the jugular foramen is the tympanic nerve. This branch reenters the temporal bone, enters the middle ear cavity, and participates in the formation of the tympanic plexus. Within the middle ear cavity it provides sensory innervation to the mucosa of the cavity, pharyngotympanic tube, and mastoid air cells.\n\nThe tympanic nerve also contributes GVE fibers, which leave the tympanic plexus in the lesser petrosal nerve—a small nerve that exits the temporal bone, enters the middle cranial fossa, and descends through the foramen ovale to exit the cranial cavity carrying preganglionic parasympathetic fibers to the otic ganglion (Table 8.6).\n\nThe vagus nerve [X] carries GSA, GVA, SA, GVE, and\n\nBE fibers:\n\nThe GSA fibers provide sensory input from the larynx, laryngopharynx, deeper parts of the auricle, part of the external acoustic meatus, and the dura mater in the posterior cranial fossa.\n\nThe GVA fibers provide sensory input from the aortic body chemoreceptors and aortic arch baroreceptors, and the esophagus, bronchi, lungs, heart, and abdominal viscera in the foregut and midgut.\n\nThe SA fibers are for taste around the epiglottis and pharynx.', 'Glossopharyngeal neuropathy in conjunction with vagus and accessory nerve palsies may occur with herpes zoster infection or with a tumor or aneurysm in the posterior fossa or in the jugular foramen. Hoarseness due to vocal cord paralysis, some difficulty in swallowing, deviation of the soft palate to the intact side, anesthesia of the posterior wall of the pharynx, and weakness of the upper part of the trapezius and sternocleidomastoid muscles make up the jugular foramen syndrome (Table 455-2).\n\nWhen the intracranial portion of one vagus (tenth cranial) nerve is interrupted, the soft palate droops ipsilaterally and does not rise in phonation. There is loss of the gag reflex on the affected side, as well as of the “curtain movement” of the lateral wall of the pharynx, whereby the faucial pillars move medially as the palate rises in saying “ah.” The voice is hoarse and slightly nasal, and the vocal cord lies immobile midway between abduction and adduction. Loss of sensation at the external auditory meatus and the posterior pinna may also be present.\n\nThe pharyngeal branches of both vagal nerves may be affected in diphtheria; the voice has a nasal quality, and regurgitation of liquids through the nose occurs during swallowing.', 'The facial nerve [VII] also innervates the platysma muscle that overlies the anterior triangle and part of the posterior triangle of the neck.\n\nThe glossopharyngeal nerve [IX] leaves the cranial cavity through the jugular foramen. It begins its descent between the internal carotid artery and the internal jugular vein, lying deep to the styloid process and the muscles associated with the styloid process. As the glossopharyngeal nerve [IX] completes its descent, it passes forward between the internal and external carotid arteries, and curves around the lateral border of the stylopharyngeus muscle (Fig. 8.172). At this point, it continues in an anterior direction, deep to the hyoglossus muscle, to reach the base of the tongue and the area of the palatine tonsil.\n\nAs the glossopharyngeal nerve [IX] passes through the area of the anterior triangle of the neck it innervates the stylopharyngeus muscle, sends a branch to the carotid sinus, and supplies sensory branches to the pharynx.\n\nThe vagus nerve [X] exits the cranial cavity through the jugular foramen between the glossopharyngeal [IX] and accessory [XI] nerves.\n\nOutside the skull the vagus nerve [X] enters the carotid sheath and descends through the neck enclosed in this structure medial to the internal jugular vein and posterior to the internal carotid and common carotid arteries (Fig. 8.173).\n\nBranches of the vagus nerve [X] as it passes through the anterior triangle of the neck include a motor branch to the pharynx, a branch to the carotid body, the superior laryngeal nerve (which divides into external and internal laryngeal branches), and possibly a cardiac branch.', 'fossa)• [V2] Maxillary division   of [V] (trigeminal nerve)Foramen ovale:(middle cranial fossa/infratemporal fossa)• [V3] Mandibular division   of [V] (trigeminal nerve)Foramen lacerum(filled with cartilage in life)Jugular foramen:(posterior cranial fossa/neck)• [IX] Glossopharyngeal nerve• [X] Vagus nerve• [XI] Accessory nerve• Internal jugular veinABForamen magnum:(posterior cranial fossa/neck)• Spinal cord• Vertebral arteries      Roots of accessory nerve [XI] pass from      upper region of spinal cord through the foramen      magnum into the cranial cavity and then leave       the cranial cavity through the jugular foramen Foramen spinosum:(middle cranial fossa/infratemporal fossa)• Middle meningeal arteryCarotid canal:(middle cranial fossa/neck)• Internal carotid arteryHypoglossal canal:(posterior cranial fossa/neck)• [XII] Hypoglossal nerveInternal acoustic meatus:(posterior cranial fossa/ear, and neckvia stylomastoid foramen)• [VII] Facial nerve• [VIII] Vestibulocochlear nerve       Labyrnthine artery and vein', 'Lymphatic vessels from the parotid gland drain into nodes that are on or in the gland. These parotid nodes then drain into superficial and deep cervical nodes.\n\nLymphatics from the submandibular and sublingual glands drain mainly into submandibular nodes and then into deep cervical nodes, particularly the jugulo-omohyoid node.\n\nParasympathetic innervation to all salivary glands in the oral cavity is by branches of the facial nerve [VII], which join branches of the maxillary [V2] and mandibular [V3] nerves to reach their target destinations.\n\nThe parotid gland, which is entirely outside the oral cavity, receives its parasympathetic innervation from fibers that initially traveled in the glossopharyngeal nerve [IX], which eventually join a branch of the mandibular nerve [V3] in the infratemporal fossa (Fig. 8.266).\n\nAll salivary glands above the level of the oral fissure, as well as all mucus glands in the nose and the lacrimal gland in the orbit, are innervated by parasympathetic fibers carried in the greater petrosal branch of the facial nerve [VII] (Fig. 8.266). Preganglionic parasympathetic fibers carried in this nerve enter the pterygopalatine fossa and synapse with postganglionic parasympathetic fibers in the pterygopalatine ganglion formed around branches of the maxillary nerve [V2]. Postganglionic parasympathetic fibers join general sensory branches of the maxillary nerve, such as the palatine nerves, destined for the roof of the oral cavity, to reach their target glands.', 'Fig. 8.266\u2002Summary of parasympathetic (secretomotor) innervation of glands in the head.\n\nLacrimal glandGlands onpalatePterygopalatine ganglionPalatine nerveLabial glandsLingual glandsSublingual glandSubmandibular glandSubmandibular ganglionOtic ganglionAuriculotemporal nerve (from [V3])Parotid gland innervated by [IX]Chorda tympani[V][VII][IX]Preganglionic parasympathetic fibers from [IX]Greater petrosal nerveAll glands abovelevel of oral fissureinnervated by greater petrosal of [VII]All glands below level of oral fissureinnervated bychorda tympani of [VII]\n\nFig. 8.267\u2002Course of parasympathetic fibers carried in the chorda tympani nerve.\n\nFig. 8.268\u2003Summary of sympathetic innervation of glands in the head.\n\nFig. 8.269\u2002Palate.\n\nFig. 8.270\u2002A. Tensor veli palatini muscles and the palatine aponeurosis. B. Levator veli palatini muscles. C. Palatopharyngeus muscles.', 'Metabolism and Blood Flow of Salivary Glands\n\nThe salivary glands produce a prodigious flow of saliva. The maximal rate of saliva production in humans is about 1 mL/ min/g of gland; thus at this rate, the glands are producing their own weight in saliva each minute. Salivary glands have a high rate of metabolism and high blood flow; both are proportional to the rate of saliva formation. Blood flow to maximally secreting salivary glands is approximately 10 times that of an equal mass of actively contracting skeletal muscle. Stimulation of the parasympathetic nerves to salivary glands increases blood flow by dilating the vasculature of the glands. Vasoactive intestinal polypeptide (VIP) and acetylcholine are released from parasympathetic nerve terminals in the salivary glands and are vasodilatory during secretion.\n\nRegulation of Salivary Secretion\n\nControl of salivary secretion is exclusively neural. In contrast, control of most other GI secretions is primarily hormonal. Salivary secretion is stimulated by both the sympathetic and parasympathetic subdivisions of the autonomic nervous system. Excitation of either sympathetic or parasympathetic nerves to the salivary glands stimulates salivary secretion. Primary physiological control of the salivary glands during the response to a meal is by the parasympathetic nervous system. If the parasympathetic supply is interrupted, salivation is severely impaired and the salivary glands atrophy.', 'Sympathetic fibers to the salivary glands stem from the superior cervical ganglion. Preganglionic parasympathetic fibers travel via branches of the facial and glossopharyngeal nerves (cranial nerves VII and IX, respectively). These fibers form synapses with postganglionic neurons in ganglia in or near the salivary glands. The acinar cells and ducts are supplied with parasympathetic nerve endings.\n\nParasympathetic stimulation increases synthesis and secretion of salivary amylase and mucins, enhances the transport activities of the ductular epithelium, greatly increases blood flow to the glands, and stimulates glandular metabolism and growth.\n\nIonic Mechanisms of Salivary Secretion\n\nFig. 28.3 shows a simplified view of the mechanisms of ion secretion by serous acinar cells. The basolateral membrane of the cell contains Na+,K+-ATPase and an Na+-K+-2Cl− symporter. The concentration gradient for Na+ across the basolateral membrane, which is dependent on Na+,K+-ATPase, provides the driving force for entry of Na+ , K+ , and Cl− into the cell. Cl− and HCO3 − leave the acinar cell and enter the lumen via an anion channel located in the apical membrane of the acinar cell. This secretion of anions drives the entry of Na+ and thus water into the acinar lumen across the relatively leaky tight junctions.\n\nAcinar cell fluid secretion is strongly enhanced in response to elevations in intracellular [Ca++] as a result of activation of the muscarinic receptor for acetylcholine.']",Afferent limb of the gag reflex,Afferent limb of the gag reflex,0.0,0.3209090909026727,0.4,1.0,0.563750337494714,golden_001,B,B,True,True
"A 3-year-old boy is brought to the emergency department with a history of unintentional ingestion of seawater while swimming in the sea. The amount of seawater ingested is not known. There is no history of vomiting. On physical examination, the boy appears confused and is asking for more water to drink. His serum sodium is 152 mmol/L (152 mEq/L). Which of the following changes in volumes and osmolality of body fluids are most likely to be present in this boy?","['Emergency treatment of symptomatic hyponatremia, such as seizures, uses IV hypertonic saline to increase the serum sodium concentration rapidly, which leads to a decrease in brain edema. One milliliter per kilogram of 3% sodium chloride increases the serum sodium by approximately 1 mEq/L.\n\nA child often improves after receiving 4 to 6 mL/kg of 3% sodium chloride.\n\nAvailable @ StudentConsult.com\n\nThere are three basic mechanisms of hypernatremia (Fig. 35-2). Sodium intoxication is frequently iatrogenic in a hospital setting resulting from correction of metabolic acidosis with sodium bicarbonate. In hyperaldosteronism, there is renal retention of sodium and resultant hypertension; the hypernatremia is mild.\n\nHypernatremia resulting from water losses develops only if the patient does not have access to water or cannot drink adequately because of neurologic impairment, emesis, or anorexia. Infants are at high risk because of their inability to control their own water intake. Ineffective breastfeeding, often in a primiparous mother, can cause severe hypernatremic dehydration. High insensible losses of water are especially common in premature infants; the losses increase further as a result of radiant warmers or phototherapy for hyperbilirubinemia. Children with extrarenal causes of water loss have high levels of ADH and very concentrated urine.', 'Serum sodium > 145 mEq/L. Usually due to water loss rather than sodium gain.\n\nPresents with thirst (due to hypertonicity) as well as with oliguria or polyuria (depending on the etiology).\n\nNeurologic symptoms include mental status changes, weakness, focal neurologic deficits, and seizures.\n\nExam reveals “doughy” skin and signs of volume depletion.\n\nAssess volume status by conducting a clinical exam and measuring urine volume and osmolality.\n\nHypertonic Na+ gain: Due to hypertonic saline/tube feeds or ↑aldosterone (suppresses ADH).\n\nPure water loss: Due to central or nephrogenic diabetes insipidus; characterized by large volumes of dilute urine. Do not neglect dermal and respiratory insensible losses.\n\nHypotonic f uid loss: Due to ↓ intake, diuretics, intrinsic renal disease, GI losses (diarrhea), burns, and osmotic diuresis (mannitol, glucose in DKA, urea with high protein feeds).\n\nA minimal volume (approximately 500 ml/day) of maximally concentrated urine (> 800 mOsm/kg) suggests adequate renal response without adequate free-water replacement.\n\nTreat the underlying causes and replace free-water deficit with hypotonic saline, D5W, or oral water, depending on volume status.\n\nCorrection of chronic hypernatremia (> 36–48 hours) should be accomplished gradually over 48–72 hours (≤ 0.5 mEq/L/hr) to prevent neurologic damage 2° to cerebral edema.\n\nSerum sodium < 135 mEq/L. Almost always due to ↑ ADH.\n\nMay be asymptomatic or may present with confusion, lethargy, muscle cramps, hyporeﬂexia, and nausea.\n\nCan progress to seizures, coma, or brain stem herniation.', 'An increase in plasma osmolarity/sodium above the normal range (hypertonic hypernatremia) can be caused by either a decrease in total body water or an increase in total body sodium. The former results from a failure to drink enough to replace normal or increased urinary and insensible water loss. The deficient intake can be due either to water deprivation or a lack of thirst (hypodipsia). The most common cause of an increase in total body sodium is primary hyperaldosteronism (Chap. 406). Rarely, it can also result from ingestion of hypertonic saline in the form of sea water or incorrectly prepared infant formula. However, even in these forms of hypernatremia, inadequate intake of water also contributes. This chapter focuses on hypodipsic hypernatremia, the form of hypernatremia due to a primary defect in the thirst mechanism.', 'As mentioned in the section on hyponatremia, a rapid rise in serum osmolality to normal or higher-than-normal levels is an almost obligate antecedent of this process. One encounters this most commonly in the rapid correction of hyponatremia. In cases related to the correction of hyponatremia, the initial serum sodium concentration is less than 130 mEq/L and usually much lower; this was the case in all the patients reported by Burcar and colleagues and by Karp and Laureno. Laureno (1983) demonstrated the importance of serum sodium in the pathogenesis of this disease experimentally. Dogs made severely hyponatremic (100 to 115 mEq/L) had the electrolyte disorder corrected rapidly by infusion of hypertonic (3 percent) saline; this led to spastic quadriparesis and pontine and extrapontine lesions were found at autopsy, indistinguishable in their distribution and histologic features from those of the human disease. Hyponatremia alone or slowly corrected hyponatremia (<15 mEq/dL in the initial 24 h) did not produce the disease.', 'Restore intravascular volume: Normal saline: 20 mL/kg over 20 min (repeat until intravascular volume restored) Determine time for correction based on initial sodium concentration [Na] 145–157 mEq/L: 24hr [Na] 158–170 mEq/L: 48hr [Na] 171–183 mEq/L: 72hr [Na] 184–196 mEq/L: 84hr Administer fluid at a constant rate over the time for correction Typical fluid: D5 1/2 normal saline (with 20 mEq/L KCI unless contraindicated) Typical rate: 1.25–1.5 times maintenance Follow serum sodium concentration and adjust fluid based on clinical status and serum sodium concentration Signs of volume depletion Sodium decreases too rapidly Sodium decreases too slowly Replace excessive ongoing losses as they occur Decrease sodium concentration of IV fluid or increase rate of IV fluid Increase sodium concentration of IV fluid or decrease rate of IV fluid Administer normal saline (20 mL/kg)\n\nFigure 33-1 Strategy for correcting hypernatremic dehydration.\n\nAs a guideline for oral rehydration, 50 mL/kg of the ORSshould be given within 4 hours to patients with mild dehydration, and 100 mL/kg should be given over 4 hours to patientswith moderate dehydration. Supplementary ORS is given toreplace ongoing losses from diarrhea or emesis. An additional 10 mL/kg of ORS is given for each stool. Fluid intakeshould be decreased if the patient appears fully hydrated earlier than expected or develops periorbital edema. After rehydration, patients should resume their usual diet (breast milk,formula).', 'As hypernatremia develops, the brain generates idiogenic osmoles to increase the intracellular osmolality and prevent the loss of brain water. This mechanism is not instantaneous and is most prominent when hypernatremia has developed gradually. If the serum sodium concentration is lowered rapidly, there is movement of water from the serum into the brain cells to equalize the osmolality in the two compartments. The resultant brain swelling manifests as seizures or coma. Because of these dangers, corrected hypernatremia should be treated gradually. The goal is to decrease the serum sodium by less than 12 mEq/L every 24 hours (see Fig. 33-1). The most important component of correcting moderate or severe hypernatremia is frequent monitoring of the serum sodium to allow adjustment of fluid therapy and provide adequate correction that is neither too slow nor too fast.\n\nIn a child with hypernatremic dehydration, as in any childwith dehydration, the first priority is restoration of intra-vascular volume with isotonic fluid. Figure 33-1 outlines a general approach for correcting hypernatremic dehydrationsecondary to gastroenteritis. If the hypernatremia and dehydration are secondary to water loss, as occurs with diabetes insipidus, a more hypotonic IV fluid is appropriate. A\xa0child with central diabetes insipidus should receive an ADH analog to prevent further excessive water loss. A child withnephrogenic diabetes insipidus requires a urine replacementsolution to offset ongoing water losses. Chronically, reducedsodium intake, thiazide diuretics, and nonsteroidal anti-inflammatory drugs can decrease water losses in nephrogenic diabetes insipidus.', 'Hypernatremic dehydration is usually a consequenceof an inability to take in fluid, because of a lack of access, apoor thirst mechanism (neurologic impairment), intractableemesis, or anorexia. The movement of water from the intracellular space to the extracellular space during hypernatremic dehydration partially protects the intravascular volume.Urine output may be preserved longer, and there may be lesstachycardia. Children with hypernatremic dehydration areoften lethargic and irritable. Hypernatremia may cause fever,\n\nClinical signs of depletion or overload Electrolytes hypertonicity, hyperreflexia, and seizures. More severe neurologic symptoms may develop if cerebral bleeding or thrombosis occurs.\n\nOverly rapid treatment of hypernatremic dehydration maycause significant morbidity and mortality. Idiogenic osmolesare generated within the brain during the development ofhypernatremia. Idiogenic osmoles increase the osmolalitywithin the cells of the brain, providing protection againstbrain cell shrinkage secondary to movement of water out of cells into the hypertonic extracellular fluid. These idiogenicosmoles dissipate slowly during correction of hypernatremia.With rapid lowering of the extracellular osmolality duringcorrection of hypernatremia, a new gradient may be createdthat causes water movement from the extracellular spaceinto the cells of the brain, producing cerebral edema. Possible manifestations of the resultant cerebral edema include altered mental status, seizures, and potentially lethal brainherniation.', 'PART 2 Cardinal Manifestations and Presentation of Diseases\n\nThe underlying cause of hypernatremia should be withdrawn or corrected, be it drugs, hyperglycemia, hypercalcemia, hypokalemia, or diarrhea. The approach to the correction of hypernatremia is outlined in Table 63-3. It is imperative to correct hypernatremia slowly to avoid cerebral edema, typically replacing the calculated free water deficit over 48 h. Notably, the plasma Na+ concentration should be corrected by no more than 10 mM/d, which may take longer than 48 h in patients with severe hypernatremia (>160 mM). A rare exception is patients with acute hypernatremia (<48 h) due to sodium loading, who can safely be corrected rapidly at a rate of 1 mM/h.\n\nWater should ideally be administered by mouth or by nasogastric tube, as the most direct way to provide free water, i.e., water without electrolytes. Alternatively, patients can receive free water in dextrose-containing IV solutions, such as 5% dextrose (D5W); blood glucose should be monitored in case hyperglycemia occurs. Depending on the history, blood pressure, or clinical volume status, it may be appropriate to initially treat with hypotonic saline solutions (1/4 or 1/2 normal saline); normal saline is usually inappropriate in the absence of very severe hypernatremia, where normal saline is proportionally more hypotonic relative to plasma, or frank hypotension. Calculation of urinary electrolyte-free water clearance (Table 63-3) is required to estimate daily, ongoing loss of free water in patients with NDI or central DI, which should be replenished daily.', 'To minimize the risk of cerebral edema during correctionof hypernatremic dehydration, the serum sodium concentration should not decrease more than 12 mEq/L every 24 hours(Figure 33-1). The deficits in severe hypernatremic dehydration may need to be corrected over 2 to 4 days. The choice andrate of fluid are not nearly as important as vigilant monitoring of the serum sodium concentration and adjustment of thetherapy based on the result (see Figure 33-1). Nonetheless, theinitial resuscitation-rehydration phase of therapy remains thesame as for other types of dehydration.\n\nMild to moderate dehydration from diarrhea of any cause canbe treated effectively using a simple, oral rehydration solution (ORS) containing glucose and electrolytes (see Chapter112). The ORS relies on the coupled transport of sodium andglucose in the intestine. Oral rehydration therapy has significantly reduced the morbidity and mortality from acute diarrhea but is underused in developed countries. It should beattempted for most patients with mild to moderate diarrhealdehydration. Oral rehydration therapy is less expensive thanIV therapy and has a lower complication rate. IV therapymay still be required for patients with severe dehydration;patients with uncontrollable vomiting; patients unable todrink because of extreme fatigue, stupor, or coma; or patients with gastric or intestinal distention. Rapidly absorbed ondansetron may be used to treat vomiting, thus facilitating oralrehydration.', '†The maximum fluid rate is normally 100 mL/hr.\n\nmaintenance therapy indefinitely; parenteral nutrition (see Chapter 34) should be used for children who cannot be fed enterally for more than a few days.\n\nDaily water losses are measurable (urine and stool) and not measurable (insensible losses from the skin and lungs). Failure to replace these losses leads to a thirsty child and, ultimately, a dehydrated child. Table 32-1 provides a system for calculating 24-hour maintenance water needs based on the patient’s weight. Sodium and potassium are given in maintenance fluids to replace losses from urine and stool.\n\nAfter calculation of water needs and electrolyte needs,children typically receive either 5% dextrose (D5) in ¼ normal saline (NS) plus 20 mEq/L of potassium chloride (KCl)or D5 in ½ NS plus 20 mEq/L of KCl. Children weighing lessthan 10 kg do best with the solution containing ¼ NS (38.5 mEq/L) because of their high water needs per kilogram. In contrast, larger children and adults may receive the solutionwith ½ NS (77 mEq/L). These guidelines assume that thereis no disease process present that would require an adjustment in either the volume or the electrolyte composition ofmaintenance fluids. Children with renal insufficiency maybe hyperkalemic or unable to excrete potassium and maynot tolerate 20 mEq/L of KCl. In children with complicatedpathophysiologic derangements, it may be necessary toadjust the electrolyte composition and rate of maintenancefluids empirically based on electrolyte measurements andassessment of fluid balance.', 'Most infectious causes of diarrhea in children are self-limited. Management of viral and most bacterial causes of diarrhea is primarily supportive and consists of correcting dehydration and ongoing fluid and electrolyte deficits and managing secondary complications resulting from mucosal injury.\n\nHyponatremia is common; hypernatremia is less common. Metabolic acidosis results from losses of bicarbonate in stool, lactic acidosis results from shock, and phosphate retention results from transient prerenal-renal insufficiency. Traditionally therapy for 24 hours with oral rehydration solutions alone is effective for viral diarrhea. Therapy for severe fluid and electrolyte losses involves IV hydration. Less severe degrees of dehydration (<10%) in the absence of excessive vomiting or shock may be managed with oral rehydration solutions containing glucose and electrolytes. Ondansetron may be administered to reduce emesis when persistent.\n\nAntibiotic therapy is necessary only for patients with S. typhi(typhoid fever) and sepsis or bacteremia with signs of systemic toxicity, those with metastatic foci, or infants younger than 3 months with nontyphoidal salmonella. Antibiotic treatment of Shigella produces a bacteriologic cure in 80% of patients after 48 hours, reducing the spread of the disease. Many Shigella sonnei isolates, the predominant strain affecting children, are resistant to amoxicillin and trimethoprim-sulfamethoxazole. Recommended treatment for children is an oral third-generation cephalosporin or a fluoroquinolone for patients 18 years and older.', 'Rapid emergence of resistance and spread to other bacteria\n\nSource: WHO Library Cataloguing-in-Publication Data: Guidelines for the control of shigellosis, including epidemics due to Shigella dysenteriae type 1 (www.who.int/cholera/ publications/shigellosis/en/).\n\nfor their use. The half-life of ciprofloxacin is longer in infants than in older individuals. The ciprofloxacin dose generally recommended for children is 30 mg/kg per day in two divided doses. Adults living in areas with high standards of hygiene are likely to develop milder, shorter-duration disease, whereas infants in endemic areas can develop severe, sometimes fatal, dysentery. In the former setting, treatment will remain minimal and bacteriologic proof of infection will often come after symptoms have resolved; in the latter setting, antibiotic treatment and more aggressive measures, possibly including resuscitation, are often required.\n\nShigella infection rarely causes significant dehydration.\n\nindustrialized countries) are uncommon. In developing countries, malnutrition remains the primary indicator for diarrhea-related death, highlighting the importance of nutrition in early management. Rehydration should be oral unless the patient is comatose or presents in shock. Because of the improved effectiveness of reduced-osmolarity oral rehydration solution (especially for children with acute noncholera diarrhea), the WHO and UNICEF now recommend a standard solution of 245 mOsm/L (sodium, 75 mmol/L; chloride, 65 mmol/L; glucose [anhydrous], 75 mmol/L; potassium, 20 mmol/L; citrate, 10 mmol/L). In shigellosis, the coupled transport of sodium to glucose may be variably affected, but oral rehydration therapy remains the easiest and most efficient form of rehydration, especially in severe cases.', 'Degree of child and family adherence is likely a predictor of the child’s success.\n\n*The common features of the transition to the toddler diet (decreased fluid intake, continued high dairy intake, and finicky eating patterns) make this a high-risk time during development for constipation problems.\n\nThe younger the child is when diagnosis and treatment begin,the higher the success rate. Treatment involves a combination of behavioral training and laxative therapy. Successfultreatment requires 6 to 24 months. The next step is adequatecolonic cleanout or disimpaction. Clean-out methods includeenemas alone or combinations of enema, suppository, and orallaxatives. High-dose oral mineral oil is a slower approach toclean-out. Choice of disimpaction method depends on the ageof the child, family choice, and the clinician’s experience witha particular method. Methods and side effects are summarized in Table 14-2. The child and family should be includedin the process of choosing the clean-out method. Because enemas may be invasive and oral medication may be unpleasant,allowing points of choice and control for the child and praisingall signs of cooperation are important.\n\nBehavioral training is essential to the treatment of chronic constipation and soiling. The child and family are asked tomonitor and document stool output. Routine toilet sitting isinstituted for 5 to 10 minutes three to four times per day. Thechild is asked to demonstrate proper toilet sitting position withthe upper body flexed forward slightly and feet on the floor\n\nEnema—6 mL/kg up to 4.5 oz (135 mL) If enemas are considered, administer first in physician’s office.', 'Gribble JN, Murray NJ, Menotti EP: Reconsidering childhood undernutri tion: can birth spacing make a difference? An analysis of the 2002–2003 El\n\nSalvador National Family Health Survey, Matern Child Nutr 5:49–63, 2009\n\nBoschert S, Robinson T: Fight obesity with specific, countable goals,\n\nPediatric News 1, Oct 2012\n\nGrover Z, Ee LC: Protein energy malnutrition, Pediatr Clin North Am 56:1055–1068, 2009\n\nKrebs NF, Hambidge KM: Trace elements. In Duggan C, Watkins JB, Walker\n\nWA, editors: Nutrition in pediatrics: basic science and clinical applications, ed 4, Hamilton, Ontario, 2008, BC Decker, pp 67–82\n\nPenny ME: Protein-energy malnutrition: pathophysiology, clinical conse quences, and treatment. In Duggan C, Watkins JB, Walker WA, editors:\n\nNutrition in pediatrics: basic science and clinical applications, ed 4, Hamil ton, Ontario, 2008, BC Decker, pp 127–142\n\nWagner CL, Greer FR: Section on Breastfeeding and Committee on Nutrition,\n\nAmerican Academy of Pediatrics: Prevention of rickets and vitamin D defi ciency: new guidelines for vitamin D intake, Pediatrics 122:1142–1152, 2008\n\nLarry A. Greenbaum and Raed Bou-Matar 7']","Increased ECF volume, decreased ICF volume, increased body osmolality","Increased ECF volume, decreased ICF volume, increased body osmolality",1.0,0.14285714284285714,0.14285714285714285,0.9423076923076924,0.7305838160467985,golden_002,D,D,True,True
"A 46-year-old male with a history of recurrent deep venous thromboses on warfarin presents to his hematologist for a follow-up visit. He reports that he feels well and has no complaints. His INR at his last visit was 2.5 while his current INR is 4.0. His past medical history is also notable for recent diagnoses of hypertension, hyperlipidemia, and gastroesophageal reflux disease. He also has severe seasonal allergies. He reports that since his last visit, he started multiple new medications at the recommendation of his primary care physician. Which of the following medications was this patient likely started on?","['. To accomplish this, the prothrombin time must be measured in fresh plasma samples from at least 20 healthy volunteers using the same coagulometer that is used for patient samples. For most indications, warfarin is administered in doses that produce a target INR of 2.0–3.0. An exception is patients with mechanical heart valves, particularly those in the mitral position or older ball and cage valves in the aortic position, where a target INR of 2.5–3.5 is recommended. Studies in atrial fibrillation demonstrate an increased risk of cardioembolic stroke when the INR falls to <1.7 and an increase in bleeding with INR values >4.5. These findings highlight the fact that vitamin K antagonists have a narrow therapeutic window. In support of this concept, a study in patients receiving long-term warfarin therapy for unprovoked venous thromboembolism demonstrated a higher rate of recurrent venous thromboembolism with a target INR of 1.5–1.9 compared with a target INR of 2.0–3.0.', 'Occasionally patients exhibit warfarin resistance, defined as progression or recurrence of a thrombotic event while in the therapeutic range. These individuals may have their INR target raised (which is accompanied by an increase in bleeding risk) or be changed to an alternative form of anticoagulation (eg, daily injections of LMW heparin or one of the newer oral anticoagulants). Warfarin resistance is most commonly seen in patients with advanced cancers, typically of gastrointestinal origin (Trousseau’s syndrome). LMW heparin is superior to warfarin in preventing recurrent venous thromboembolism in patients with cancer.\n\nThe coumarin anticoagulants often interact with other drugs and with disease states. These interactions can be broadly divided into pharmacokinetic and pharmacodynamic effects (Table 34–2). Pharmacokinetic mechanisms for drug interaction with warfarin mainly involve cytochrome P450 CYP2C9 enzyme induction, enzyme inhibition, and reduced plasma protein binding. Pharmacodynamic mechanisms for interactions with warfarin are synergism (impaired hemostasis, reduced clotting factor synthesis, as in hepatic disease), competitive antagonism (vitamin K), and an altered physiologic control loop for vitamin K (hereditary resistance to oral anticoagulants).\n\nThe most serious interactions with warfarin are those that increase the anticoagulant effect and the risk of bleeding. The most dangerous of these interactions are the pharmacokinetic interactions with the mostly obsolete pyrazolones phenylbutazone and sulfinpyrazone. These drugs not only augment the hypoprothrombinemia but also inhibit platelet function and may induce peptic ulcer disease (see Chapter 36). The mechanisms interactions with oral anticoagulants.\n\n1Stereoselectively inhibits the oxidative metabolism of the S-warfarin enantiomorph of racemic warfarin.', 'Because of the potential for skin necrosis, patients with known protein C or protein S deficiency require overlapping treatment with a parenteral anticoagulant when initiating war- farin therapy. Warfarin should be started in low doses in these patients, and the parenteral anticoagulant should be continued until the INR is therapeutic for at least 2–3 consecutive days.\n\npregnancy Warfarin crosses the placenta and can cause fetal abnormalities or bleeding. The fetal abnormalities include a characteristic embryopathy, which consists of nasal hypopla-Monitoring No No No No sia and stippled epiphyses. The risk of embry-Interactions 3A4/P-gp 3A4/P-gp P-gp P-gp opathy is highest if warfarin is given in the first Abbreviations: bid, twice a day; P-gp, P-glycoprotein; qd., once a day.\n\n52% compared with warfarin (p <.0001), but increase gastrointestinal bleeding by about 24% (p = .04). Overall, the new agents demonstrate a favorable benefit-to-risk profile compared with warfarin, and their relative efficacy and safety are maintained across a wide spectrum of atrial fibrillation patients, including those over the age of 75 years and those with a prior history of stroke. Based on these findings, dabigatran, rivaroxaban, and apixaban are licensed as alternatives to warfarin for stroke prevention in nonvalvular atrial fibrillation, and edoxaban is under regulatory consideration for this indication. Nonvalvular atrial fibrillation is defined as that occurring in patients without mechanical heart valves or severe rheumatic valvular disease, particularly mitral stenosis and/or regurgitation.', 'The majority of patients warrant chronic anticoagulation, but selection of therapy should be individualized based on patient profile and risks and benefits of individual agents. Anticoagulation with a vitamin K antagonist is warranted for all patients with AF who have rheumatic mitral stenosis or mechanical heart valves for whom the newer anticoagulants have not been tested. Anticoagulation with a vitamin K antagonist (warfarin) or the newer oral anticoagulants is warranted for patients who have had more than 48 h of AF and are undergoing cardioversion, for patients who have a prior history of stroke, or for patients with a CHA2DS2-VASc score of ≥2, but it may be considered in patients with a risk score of 1. The approach to patients with paroxysmal AF is the same as for persistent AF. It is recognized that many patients who appear to have infrequent AF episodes often have asymptomatic episodes that put them at risk. Absence of AF during periodic monitoring is not sufficient to indicate low risk. The role of continuous monitoring with implanted recorders or pacemakers is not yet clear as a guide for anticoagulation in patients with a borderline risk profile. Bleeding is the major risk of anticoagulation. Major bleeding requiring transfusion or in a critical area (e.g., intracranial) occurs in approximately 1% of patients per year. Risk factors for bleeding include age >65–75 years, heart failure, history of anemia, and excessive alcohol or nonsteroidal anti-inflammatory drug use. Patients with coronary stents who require antiplatelet therapy with aspirin and a thienopyridine are at particularly high risk of bleeding.', '(Fig. 284-1) Penicillin prophylaxis of group A β-hemolytic streptococcal infections (Chap. 381) for secondary prevention of rheumatic fever is important for at-risk patients with rheumatic MS. Recommendations for infective endocarditis prophylaxis are similar to those for other valve lesions and are restricted to patients at high risk for complications from infection, including patients with a history of endocarditis. In symptomatic patients, some improvement usually occurs with restriction of sodium intake and small doses of oral diuretics. Beta blockers, nondihydropyridine calcium channel blockers (e.g., verapamil or diltiazem), and digitalis glycosides are useful in slowing the ventricular rate of patients with AF. Warfarin therapy targeted to an international normalized ratio (INR) of 2–3 should be administered indefinitely to patients with MS who have AF or a history of thromboembolism. The routine use of warfarin in patients in sinus rhythm with LA enlargement (maximal dimension\n\nRheumatic MS Very severe MS MVA ˜1 cm2 T½ °220 ms Severe MS MVA ˜1.5 cm2 T½ °150 ms Progressive MS MVA >1.5 cm2 T½ <150 ms Asymptomatic (stage C) Asymptomatic (stage C) Symptomatic (stage D) Symptomatic with no other cause Class I Class IIa Class IIb', 'Pharmacodynamic reductions of anticoagulant effect occur with increased vitamin K intake (increased synthesis of clotting factors), the diuretics chlorthalidone and spironolactone (clotting factor concentration), hereditary resistance (mutation of vitamin K reactivation cycle molecules), and hypothyroidism (decreased turnover rate of clotting factors).\n\nDrugs with no significant effect on anticoagulant therapy include ethanol, phenothiazines, benzodiazepines, acetaminophen, opioids, indomethacin, and most antibiotics.\n\nReversal of Warfarin Action\n\nExcessive anticoagulant effect and bleeding from warfarin can be reversed by stopping the drug and administering oral or parenteral vitamin K1 (phytonadione), fresh-frozen plasma, prothrombin complex concentrates, and recombinant factor VIIa (rFVIIa). A four-factor concentrate containing factors II, VII, IX, and X (Prothrombin Complex Concentrate, [Human]; Kcentra) (4F PCC) is available. The disappearance of excessive effect is not correlated with plasma warfarin concentrations but rather with reestablishment of normal activity of the clotting factors. A modest excess of anticoagulant effect without bleeding may require no more than cessation of the drug. The warfarin effect can be rapidly reversed in the setting of severe bleeding with the administration of prothrombin complex or rFVIIa coupled with intravenous vitamin K. It is important to note that due to the long half-life of warfarin, a single dose of vitamin K or rFVIIa may not be sufficient.', 'Can increase warfarin levels. Monitor INR closely if drugs are given concomitantly. Increased effect of warfarin. Monitor levels closely if drugs are given concomitantly.\n\nIncreased levels of phenytoin. Monitor levels closely if drugs are given concomitantly. Increased levels of methotrexate. Monitor levels closely if drugs are given concomitantly.\n\nCan result in decreased levels of interacting drug. Avoid concomitant use if possible. If giving drugs concomitantly, monitor drug levels if possible. Can result in increased levels of interacting drug. Avoid concomitant use if possible. If giving drugs concomitantly, monitor drug levels if possible.\n\nTreatment and Prophylaxis of Bacterial Infections aDrug reaction described with ciprofloxacin only. bClarithromycin and erythromycin are potent CYP3A4 inhibitors; the probability of a drug interaction with azithromycin is lower. Abbreviations: INR, international normalized ratio; SSRI, selective serotonin-reuptake inhibitor; TMP-SMX, trimethoprim-sulfamethoxazole.\n\nbut typically inhibit the S. aureus class A β-lactamase, β-lactamases of H. influenzae and Bacteroides species, and a number of plasmid-encoded β-lactamases. These combination agents are typically used when broader-spectrum coverage is needed—e.g., in pneumonia and intraabdominal infections. Piperacillin-tazobactam is a useful agent for broad coverage in febrile neutropenic patients. The combination agents, however, are not effective against organisms that produce AmpC β-lactamases or carbapenemases.', '. Increased warfarin requirements may also be needed in patients taking contraceptives or estrogen-containing compounds, corti-costeroids, and adrenocorticotropic hormone (ACTH). Medica-tions that can alter warfarin requirements are shown in Table 4-4.Although warfarin use is often associated with a signifi-cant increase in morbidity and mortality in acutely injured and emergency surgery patients, with rapid reversal, these com-plications can be reduced. There are several reversal options that include vitamin K administration, plasma, cryoprecipi-tate, recombinant factor VIIa, and factor concentrates. The 2012 CHEST guidelines for the Management of Anticoagulant Therapy Antithrombotic Therapy and Prevention of Thrombo-sis recommends patients with major life-threatening bleeding TRAUMATICCLINICALCOAGULOPATHICBLEEDING?PlateletactivationEGLsheddingEndothelial activationAcidosisHypothermiaHemorrhageShock˜˜˜tPA &°PAI-1Hypo-perfusionClotting factorconsumptionPre-injuryanticoagulantmedicationIatrogenicresuscitationinjuryHemodilution˜Acidosis˜HypothermiaAuto-heparinization°Clotting factoractivityPlatelet dysfunctionHyperfibrinolysis˜Catecholamines˜APCFigure 4-5.\u2002Illustration of the pathophysiologic mechanism responsible for the acute coagulopathy of trauma. APC = activated protein C; EGL = endothelial glycocalyx; PAI-1 = plasminogen activator inhibitor 1; tPA = tissue plasminogen activator; TIC = trauma-induced coagulopathy', '1Stereoselectively inhibits the oxidative metabolism of the S-warfarin enantiomorph of racemic warfarin.\n\nfor their hypoprothrombinemic interaction are a stereoselective inhibition of oxidative metabolic transformation of S-warfarin (the more potent isomer) and displacement of albumin-bound warfarin, increasing the free fraction. For this and other reasons, neither phenylbutazone nor sulfinpyrazone is in common use in the United States. Metronidazole, fluconazole, and trimethoprimsulfamethoxazole also stereoselectively inhibit the metabolic transformation of S-warfarin, whereas amiodarone, disulfiram, and cimetidine inhibit metabolism of both enantiomorphs of warfarin (see Chapter 4). Aspirin, hepatic disease, and hyperthyroidism augment warfarin’s effects—aspirin by its effect on platelet function and the latter two by increasing the turnover rate of clotting factors. The third-generation cephalosporins eliminate the bacteria in the intestinal tract that produce vitamin K and, like warfarin, also directly inhibit vitamin K epoxide reductase.\n\nBarbiturates and rifampin cause a marked decrease of the anticoagulant effect by induction of the hepatic enzymes that transform racemic warfarin. Cholestyramine binds warfarin in the intestine and reduces its absorption and bioavailability.\n\nPharmacodynamic reductions of anticoagulant effect occur with increased vitamin K intake (increased synthesis of clotting factors), the diuretics chlorthalidone and spironolactone (clotting factor concentration), hereditary resistance (mutation of vitamin K reactivation cycle molecules), and hypothyroidism (decreased turnover rate of clotting factors).', 'To minimize the risk of bleeding, the INR should be maintained can safely be given to nursing mothers.in the therapeutic range. In asymptomatic patients whose INR is special problems Patients with a lupus anticoagulant and those whobetween 3.5 and 10, warfarin should be withheld until the INR returns need urgent or elective surgery present special challenges. Although to the therapeutic range. If the INR is over 10, oral vitamin K should observational studies suggested that patients with thrombosis com-be administered, at a dose of 2.5–5 mg, although there is no evidence plicating the antiphospholipid antibody syndrome required higherthat doing so reduces the bleeding risk. Higher doses of oral vitamin intensity warfarin regimens to prevent recurrent thromboembolicK (5–10 mg) produce more rapid reversal of the INR but may render events, two randomized trials showed that targeting an INR of 2.0–3.0 patients temporarily resistant to warfarin when the drug is restarted.\n\nis as effective as higher intensity treatment and produces less bleed-Patients with serious bleeding need more aggressive treatment. These ing. Monitoring warfarin therapy can be problematic in patients with patients should be given 5–10 mg of vitamin K by slow IV infusion.\n\nantiphospholipid antibody syndrome if the lupus anticoagulant pro-Additional vitamin K should be given until the INR is in the nor-longs the baseline INR; factor X levels can be used instead of the INRmal range. Treatment with vitamin K should be supplemented with in such patients.', '. In patients with VTE related to malignancy, increasing evidence suggests that longer-term therapy with LMWH (up to 6 months) is associated with a lower VTE recurrence than treatment using conventional vitamin K antagonists.57,58 The primary complication of warfarin therapy is hemorrhage, and the risk is related to the magnitude of INR prolongation. Depending on the INR and the presence of bleeding, warfarin anticoagulation may be reversed by (a) omit-ting or decreasing subsequent dosages, (b) administering oral or parenteral vitamin K, or (c) administering fresh frozen plasma, prothrombin complex concentrate, or recombinant factor VIIa.49Warfarin therapy rarely may be associated with the devel-opment of skin necrosis and limb gangrene. These conditions occur more commonly in women (4:1), and the most commonly affected areas are the breast, buttocks, and thighs. This com-plication, which usually occurs in the first days of therapy, is occasionally, but not exclusively, associated with protein C or S deficiency and malignancy. Patients who require continued anticoagulation may restart low-dose warfarin (2 mg) while receiving concomitant therapeutic heparin. The warfarin dosage is then gradually increased over a 1to 2-week period.49Systemic and Catheter-Directed Thrombolysis.\u2002Patients with extensive proximal, iliofemoral DVT may benefit from systemic thrombolysis or catheter-directed thrombolysis (CDT)']",Omeprazole,Omeprazole,0.0,0.0,0.0,0.8500000000000001,0.5955084734458843,golden_005,A,A,True,True
"A five-year-old female presents to the pediatrician for a well visit. The patient’s parents report that she recently entered kindergarten and her teacher expressed concern that the patient is not meeting developmental milestones. She struggles to name colors and has not expressed any interest in learning to read. The patient’s parents have also noticed that the patient is not completing tasks that her older siblings were doing by this age, including dressing herself independently and going to the bathroom by herself. The patient rolled over at 9 months, sat without support at 12 months, and walked at 20 months. Her parents also report that the patient is very social, and that adults frequently comment on her friendly personality. The patient is in the 15th percentile for weight and 5th percentile for height. On physical exam, the patient has a broad forehead, flat nasal bridge, long philtrum, and a wide mouth. She has a strabismus on neurological exam, and her cardiac exam is significant for a heart murmur. Laboratory testing is below:

Serum:
Na+: 145 mEq/L
K+: 3.9 mEq/L
Cl-: 100 mEq/L
HCO3-: 24 mEq/
Urea nitrogen: 11 mg/dL
Glucose: 76 mg/dL
Creatinine: 0.9 mg/dL
Ca2+: 11.9 mg/dL

Which of the following cardiac abnormalities is associated with this condition?","['Wilmott RW, Boat TF, Bush A, et\xa0al: Kendig and Chernick’s Disorders of the\n\nRespiratory Tract in Children, ed 8, Philadelphia, 2012, Saunders\n\nThe Cardiovascular System\n\nDaniel S. Schneider 19\n\nA maternal history of medication, drug, or alcohol use or excessive smoking may contribute to cardiac and other systemic findings. The prenatal history may reveal a maternal infection early in pregnancy (possibly teratogenic) or later in pregnancy (causing myocarditis or myocardial dysfunction in infants). Infants with heart failure exhibit poor growth, with weight being more significantly affected than height and head circumference.\n\nHeart failure may present with fatigue or diaphoresis with feeds or fussiness. Tachypnea without significant dyspnea may be present. Older children with heart failure may have easy fatigability, shortness of breath on exertion, and sometimes orthopnea. Not keeping up with other children during play or exercise is a sign of exercise intolerance. Heart failure may be misdiagnosed as recurrent pneumonia, bronchitis, wheezing, or asthma.\n\nA history of a heart murmur is important, but many wellchildren have an innocent murmur at some time in their lives. Other cardiac symptoms include cyanosis, palpitations, chest pain, syncope, and near-syncope. A review ofsystems assesses for possible systemic diseases or congenitalmalformation syndromes that may cause cardiac abnormalities (Tables 139-1 and 139-2). Current and past medication use as well as history of drug use, is important. Family history should be reviewed for hereditary diseases, early atherosclerotic heart disease, congenital heart disease, suddenunexplained deaths, thrombophilia, rheumatic fever, hypertension, and hypercholesterolemia.', ""Kerhof, 2012; McCloskey, 2016).\n\nMounting evidence suggests that fetal-growth restriction may afect organ development, particularly that of the heart. Individuals with low birthweight demonstrate cardiac structural changes and dysfunction persisting through childhood, adolescence, and adulthood. In one study, 80 infants who were born SGA before 34 weeks' gestation were compared at 6 months with 80 normally grown children (Cruz-Lemini, 2016). The heart in the SGA children had a more globular ventricle that resulted in systolic and diastolic dysfunction. In another study, echocardiography in 418 adolescents showed that low birthweight was associated with a thicker let ventricular posterior wall (Hietalampi, 2012). In their review, Cohen and colleagues (2016) concluded, however, that these findings have unclear long-term signiicance.\n\nDeficient fetal growth is also associated with postnatal structural and functional renal changes. In a review by Luyckx and Brenner (2015), birthweight abnormalities were evaluated for linkage with disordered nephrogenesis, renal dysfunction, chronic kidney disease, and hypertension. Both low and high birthweight, as well as maternal obesity and gestational diabetes, afect in-utero development of the kidney and its health into adulthood. However, other variables that include childhood nutrition, acute kidney injury, excessive childhood weight gain, and obesity also worsen long-term renal function."", 'The differentiation of the inherited metabolic diseases of infancy rests essentially upon four types of data: (1) a few highly characteristic neurologic and ophthalmic signs; (2) the presence of an enlarged liver and/or spleen; (3) dysmorphic features of the face; and (4) the results of several relatively simple laboratory tests, such as images of the thoracolumbar spine, hips, and long bones; smears of the peripheral blood and bone marrow; CSF examination; and certain urinary tests and other biochemical estimations (serum lactate, glucose, ammonia, and urinary ketones, amino acids, and organic acids). For purposes of differential diagnosis, we have found the flowcharts constructed by our colleague, E.H. Kolodny, to be very useful. One such schematic, illustrated in Fig. 36-4, is based on the subdivision of patients into three groups: (1) dysmorphic, (2) visceromegalic, and (3) purely neurologic. Only rarely does an inherited metabolic disease fall into more than one of these categories. There is also considerable value in beginning the diagnostic process by classifying the syndrome as a leukodystrophy or a poliodystrophy (disease predominantly affecting neurons, see further on), although this distinction is easier to make in the older child.\n\nOnce the major category of disease has been identified, correct diagnosis depends on particular clinical and laboratory features tabulated below (Tables 36-5 and 36-6).\n\nOf course, in the current era genetic testing discloses the diagnosis of most of these disorders but unless whole exome screening is planned to be undertaken, the clinician must have some idea of the likely diagnosis. Panels of over 100 genes pertaining to nuclear and mitochondrial causes of leukodystrophy are available.', 'Haragan AF, Hulsey TC, Hawk AF, et al: Diagnostic accuracy of fundal height and handheld ultrasound-measured abdominal circumference to screen for fetal growth abnormalities. Am J Obstet Gynecol 212(6):820. e1,e2015\n\nHealy CM, Rench A, Baker CJ: Importance of timing of maternal combined tetanus, diphtheria, and acellular pertussis (Tdap) immunization and protection of young infants. Clin Infect Dis 56(4):539, 2013\n\nHerbert WNP, Bruninghaus HM, Barefoot AB, et al: Clinical aspects of fetal heart auscultation. Obstet GynecoIe69:574, 198\n\nHibbeln JR, Davis JM, Steer C, et al: Maternal seafood consumption in pregnancy and neurodevelopmental outcomes in childhood (LSPAC study): an observation cohort study. Lancet 369:578, 2007\n\nHigginbottom MC, Sweetman L, Nyhan L: A syndrome of methylmalonic aciduria, homocystinuria, megaloblastic anemia and neurologic abnormalities in a vitamin B 12-deicient breast-fed infant of a strict vegetarian. N Engl J Med 299:317, 1978\n\nHiggins JR, Walshee]], Conroy M, et al: The relation between maternal work, ambulatory blood pressure, and pregnancy hypertension. J Epidemiol Community Health 56:389, 2002\n\nHollier LM, Hill J, Sheield JS, et al: State laws regarding prenatal syphilis screening in the United States. Am J Obstet Gynecol 189: 1178, 2003 Horowitz HS, Heifetz SB: Efects of prenatal exposure to fluoridation on dental caries. Public Health Rep 82:297, 1967', 'GSD, Glycogen storage disease.\n\nThe assessment begins with a careful history (family and individual) and clinical evaluation. Clinical laboratory testing can define the metabolic derangement (Table 51-7). The results generate a differential diagnosis and a list of more specific laboratory testing to confirm the diagnosis.\n\nThe combination of symptoms and abnormal clinical laboratory findings demands urgent metabolic evaluation. Ametabolic emergency often presents with vomiting, acidosis,hypoglycemia, ketosis (or lack of appropriate ketosis), inter-current infection, anorexia/failure to feed, lethargy proceeding to coma, and hyperventilation or hypoventilation. Clinicalevaluation should focus on the cardiac, renal, neurologic, anddevelopmental assessment as well as looking for changes inmental status, seizures, abnormal tone, visual symptoms,poor developmental progress, global developmental delay,loss of developmental milestones (regression), cardiomyopathy, cardiac failure, cystic renal malformation, and renal tubular dysfunction.\n\nClinical laboratory testing should begin with tests that are available in most hospital clinical laboratories. Care in the collection and handling of laboratory specimens is crucial to obtaining accurate results. Plasma measurements oflactate and ammonia are particularly subject to spuriousresults if not handled correctly. Significant ketosis in theneonate is unusual and suggests an organic acid disorder.Ketosis out of proportion to fasting status in an older child occurs in disorders of ketone usage. Lack of severe ketosis in an older child under conditions of metabolic stress is a', 'Genetic defects associated with hypoparathyroidism serve to illuminate the complexity of organ development, hormonal biosynthesis and secretion, and tissue-specific patterns of endocrine effector function (Fig. 424-5). Often, hypoparathyroidism is isolated, signifying a highly specific functional disturbance. When hypoparathyroidism is associated with other developmental or organ defects, treatment of the hypocalcemia can still be effective.\n\nA form of hypoparathyroidism associated with defective development of both the thymus and the parathyroid glands is termed the DiGeorge syndrome, or the velocardiofacial syndrome. Congenital cardiovascular, facial, and other developmental defects are present, and patients may die in early childhood with severe infections, hypocalcemia and seizures, or cardiovascular complications. Patients can survive into adulthood, and milder, incomplete forms occur. Most cases are sporadic, but an autosomal dominant form involving micro-deletions of chromosome 22q11.2 has been described. Smaller deletions in chromosome 22 are seen in incomplete forms of the DiGeorge syndrome, appearing in childhood or adolescence, that are manifest primarily by parathyroid gland failure. The chromosome 22 defect is now termed DSG1; more recently, a defect in chromosome 10p is also recognized—now called DSG2. The phenotypes seem similar. Studies on the chromosome 22 defect have pinpointed a transcription factor, TBX1. Deletions of the orthologous mouse gene show a phenotype similar to the human syndrome.', 'Abnormalities associated with Turner syndrome include left sided cardiac defects-such as coarctation of the aorta, hypo plastic left heart syndrome, or bicuspid aortic valve-in 30 to 50 percent; renal anomalies, particularly horseshoe kidney; and hypothyroidism. Other features are short stature, broad chest with widely spaced nipples, congenital lymphedema-pui ness over the dorsum of hands and feet, and a ""webbed"" pos terior neck resulting from cystic hygromas. Intelligence scores are generally in the normal range, but afected individuals are at risk for diiculties with visual-spatial organization, nonver bal problem solving, and interpretation of social cues Q ones, 2006). Growth hormone is typically administered in childhood to ameliorate short stature (Kappelgaard, 201i1). More than 90 starting just before adolescence. An exception is mosaicism involving the Y chromosome, as this confers risk for germ cell neoplasm-regardless of whether the child is phenotypically male or female. Accordingly, eventual prophylactic bilateral gonadectomy is indicated (Cools, 2011; Schorge, 2016).', 'Vasudevan P, Suri M: A clinical approach to developmental delay and intellectual disability. Clin Med 17:558, 2017.\n\nVerhagen MM, Abdo WF, Willemsen MA, et al: Clinical spectrum of ataxia-telangiectasia in adulthood. Neurology 73:430, 2009.\n\nVolpe JJ: Intraventricular hemorrhage in the premature infant: Current concepts, parts I and II. Ann Neurol 25:3, 109, 1989.\n\nVolpe JJ: Neurology of the Newborn, 3rd ed. Philadelphia,\n\nSaunders, 1995.\n\nWeber F, Parkes R: Association of extensive haemangiomatous naevus of skin with cerebral (meningeal) haemangioma, especially cases of facial vascular naevus with contralateral hemiplegia. Proc R Soc Med 22:25, 1929.\n\nWeiss LA, Shen Y, Kom J, et al: Association between microdeletion and microduplication at 16p11.2 and autism. N Engl J Med 358:667, 2008.\n\nWeller TH: The cytomegaloviruses: Ubiquitous agents with protean clinical manifestations. N Engl J Med 285:267, 1971.\n\nWilliams JC, Barratt-Boyes BG, Lowe JB: Supravalvular aortic stenosis. Circulation 24:1311, 1961.\n\nWilson GS, Desmond MM, Verniand W: Early development of infants of heroin-addicted mothers. Am J Dis Child 126:457, 1973.\n\nWinick M: Malnutrition and Brain Development. New York, Oxford University Press, 1976.', 'This inherited form of developmental delay is manifest in both males and females and was mentioned earlier. It is characterized by mild and variable developmental delay but with sometimes striking retention and even precocity or superiority of musical aptitude and social amiability. In some instances, a retained facility for writing permits the production of long, written descriptions; yet at the same time, these subjects are barely able to draw simple objects. The child is physically slow and has minor but distinctive somatic changes (wide mouth, almond-shaped eyes, short upturned nose, flat nasal bridge, long philtrum, delicate chin, and small pointed ears), together imparting an “elfin appearance” that is nonetheless variable and not as apparent in adulthood as the facial features coarsen. There is often an unusual sensitivity to auditory stimuli. The delay in acquisition of communicative speech and defects in visual, spatial, and motor skills make these children seem more deficient than they actually are. Striking sociability and empathy set them apart; they represent virtually the converse of autism in this respect. Memory for musical scores—such as memorizing parts of a complete symphony after one hearing—may be prodigious.\n\nBy the use of high-resolution cytogenetics, the disease was traced in over 90 percent of cases to a deletion on chromosome 7 in the ELN gene that controls the production of elastin (Nickerson et al). This is of interest because one index feature of these cases is supravalvular aortic stenosis and variations (but not necessarily deletions) in the same gene account for cases of familial supravalvular stenosis without developmental delay. This cardiovascular disease is the main cause of death in these individuals.', 'Structural cardiac anomalies are the most common birth defects, with a birth prevalence of 8 cases per 1000. More than o.�c 5.\n\no..=\n\nFIGURE 13-10 Schematic example of a threshold trait, such as pyloric stenosis, which has a predilection for males. Each gender is normally distributed, but at the same threshold, more males than females will develop the condition.\n\n100 genes believed to be involved in cardiovascular morphogenesis have been identiied, including those directing production of various proteins, protein receptors, and transcription factors (Olson, 2006; Weismann, 2007).\n\nhe risk of having a child with a cardiac anomaly is approximately 5 to 6 percent if the mother has the defect and 2 to 3 percent if the father has the defect (Burn, 1998). Selected left-sided lesions, including hypoplastic left heart syndrome, coarctation of the aorta, and bicuspid aortic valve, may have recurrence risks four-to sixfold higher (Lin, 1988; Lupton, 2002; Nora, 1988). Observed recurrence risks for specific cardiac malformations are listed in Table 49-4 (p. 953).', '. Discrete subaor-tic stenosis: incidence, morphology, and surgical impact of associated subaortic anomalies. Ann Thorac Surg. 2003;75(6):1763-1768.\t31.\tKaramlou T, Gurofsky R, Bojcevski A, et al. Prevalence and associated risk factors for intervention in 313 children with subaortic stenosis. Ann Thorac Surg. 2007;84:900-906.\t32.\tSomerville J, Stone S, Ross D. Fate of patients with fixed subaortic stenosis after surgical removal. Br Heart J. 1980; 43(6):629-647.\t33.\tWilliams JCP, Barratt-Boyes BG, Lowe JB. Supravalvular aortic stenosis. Circulation. 1961;24:1311-1318.Brunicardi_Ch20_p0751-p0800.indd   79522/02/19   2:57 PM 796SPECIFIC CONSIDERATIONSPART\u2008II\t34.\tTworetzky W, Wilkins-Haug L, Jennings RW, et al. Balloon dilation of severe aortic stenosis in the fetus: potential for pre-vention of hypoplastic left heart syndrome: candidate selection, technique, and results of successful intervention. Circulation. 2004;110(15):2125-2131.\t35.\tvan Son JM, Danielson GK, Puga FJ, et al. Supravalvular aor-tic stenosis: long-term results of surgical treatment. J Thorac Cardiovasc Surg. 1994;107(1):103-114.\t36.\tSharma BK, Fujiwara H, Hallman GL, et al', 'supravalvular aortic stEnosis This is a localized or diffuse narrowing of the ascending aorta originating just above the level of the coronary arteries at the superior margin of the sinuses of Valsalva. In contrast to other forms of aortic stenosis, the coronary arteries are subjected to elevated systolic pressures from the LV, are often dilated and tortuous, and are susceptible to premature atherosclerosis. The coronary ostia may also become obstructed by the aortic valve leaflets. In most patients, a genetic defect for the anomaly is located in the same chromosomal region as elastin on chromosome 7. Supravalvular aortic stenosis is the most commonly associated cardiac defect in Williams-Beuren syndrome, typically comprising the following: “elfin” facies, low nasal bridge, cheerful demeanor, mental retardation with retained language skills and love of music, supravalvular aortic stenosis, and transient hypercalcemia.\n\nNarrowing or constriction of the lumen of the aorta may occur anywhere along its length but is most common distal to the origin of the left subclavian artery near the insertion of the ligamentum arteriosum. Coarctation occurs in ~7% of patients with CHD, is more common in males than females, and is particularly frequent in patients with gonadal dysgenesis (e.g., Turner’s syndrome). Clinical manifestations depend on the site and extent of obstruction and the presence of associated cardiac anomalies, most commonly a bicuspid aortic valve. Circle of Willis aneurysms may occur in up to 10%.', '. Supravalvular aor-tic stenosis: long-term results of surgical treatment. J Thorac Cardiovasc Surg. 1994;107(1):103-114.\t36.\tSharma BK, Fujiwara H, Hallman GL, et al. Supravalvular aortic stenosis: a 29-year review of surgical experience. Ann Thorac Surg. 1991;51:1031-1039.\t37.\tMcElhinney DB, Petrossian E, Tworetzky W, Silverman NH, Hanley FL. Issues and outcomes in the management of supravalvular aortic stenosis. Ann Thorac Surg. 2000;69(2): 562-567.\t38.\tClyman RI, Mauray F, Roman C, Rudolph AM, Heymann MA. Circulating PGE2 concentration and patent ductus arteriosus in fetal and neonatal lambs. J Pediatr. 1982;97(3):455-463.\t39.\tMcMurphy DM, Heymann MA, Rudolph AM, Melmon KL. Developmental change in constriction of the ductus arteriosus: response to oxygen and vasoactive substances in the isolated duc-tus arteriosus of the fetal lamb. Pediatr Res. 1972;6(4):231-238.\t40.\tMitchell SC, Korones SB, Berendes HW. Congenital heart disease in 56,109 births. Incidence and natural history. Circu-lation. 1971;43(3):323-332.\t40.\tCampbell M. Natural history of persistent ductus arteriosus. Br Heart J', '. In some individuals, there may be difficulty in distinguishing between hypertrophic cardiomyopathy and diffuse subaortic steno-sis. Operation for subvalvular AS is indicated with a gradient exceeding 30 mmHg, in the presence of aortic valve insuffi-ciency, or when symptoms indicating LVOT obstruction are present.30 Given that repair of isolated discrete subaortic ste-nosis can be done with low rates of morbidity and mortality, some surgeons advocate repair in all cases of discrete AS to avoid progression of the stenosis and the development of aortic insufficiency, although more recent data demonstrate that sub-aortic resection should be delayed until the LV gradient exceeds  30 mmHg because most children with an initial LV gradient less than 30 mmHg have quiescent disease.31 Diffuse AS is a more complex lesion and often requires aortoventriculoplasty. Results are generally excellent, with operative mortality less than 5%.32Supravalvular AS occurs more rarely and also can be clas-sified into a discrete type, which produces an hourglass defor-mity of the aorta, and a diffuse form that can involve the entire arch and brachiocephalic arteries. The aortic valve leaflets are usually normal, but in some cases, the leaflets may adhere to the supravalvular stenosis, thereby narrowing the sinuses of Valsalva in diastole and restricting coronary artery perfusion. In addition, accelerated intimal hyperplastic changes in the coronary arteries can be demonstrated in these patients because the proximal position of the coronary arteries subjects them to abnormally high perfusion pressures.The signs and symptoms of supravalvular AS are similar to other forms of LVOT obstruction. An asymptomatic murmur is the presenting manifestation in approximately half of these patients. Syncope, poor exercise tolerance, and angina may all occur with nearly equal frequency']",Supravalvular aortic stenosis,Supravalvular aortic stenosis,1.0,0.29441160690670004,0.6666666666666666,1.0,0.6625049975785187,golden_006,C,C,True,True
"A 10-year-old boy is brought in by his mother with increasing abdominal pain for the past week. The patient’s mother says he has been almost constantly nauseous over that time. She denies any change in his bowel habits, fever, chills, sick contacts or recent travel. The patient has no significant past medical history and takes no medications. The patient is at the 90th percentile for height and weight and has been meeting all developmental milestones. The temperature is 36.8℃ (98.2℉). On physical examination, the patient’s abdomen is asymmetrically distended. Bowel sounds are normoactive. No lymphadenopathy is noted. A cardiopulmonary examination is unremarkable. Palpation of the right flank and right iliac fossa reveals a 10 × 10 cm firm mass which is immobile and tender. The laboratory findings are significant for the following: 
Hemoglobin 10 g/dL
Mean corpuscular volume 88 μm3
Leukocyte count 8,000/mm3
Platelet count 150,000/mm3
    Serum creatinine 1.1 mg/dL
Serum lactate dehydrogenase (LDH) 1,000 U/L
An ultrasound-guided needle biopsy of the flank mass was performed, and the histopathologic findings are shown in the exhibit (see image). Which of the following is the most likely diagnosis in this patient?","['. Laboratory findings reflect intravascular volume deple-tion and consist of hemoconcentration and electrolyte abnor-malities. Mild leukocytosis is common.Features of strangulated obstruction include abdominal pain often disproportionate to the degree of abdominal findings, suggestive of intestinal ischemia. Patients often have tachycar-dia, localized abdominal tenderness, fever, marked leukocyto-sis, and acidosis. Any of these findings should alert the clinician to the possibility of strangulation and the need for early surgical intervention.DiagnosisThe diagnostic evaluation should focus on the following goals: (a) distinguish mechanical obstruction from ileus, (b) determine the etiology of the obstruction, (c) discriminate partial from complete obstruction, and (d) discriminate simple from stran-gulating obstruction.Important elements to obtain on history include prior abdominal operations (suggesting the presence of adhesions) and the presence of abdominal disorders (e.g., intra-abdominal cancer or inflammatory bowel disease) that may provide insights into the etiology of obstruction. Upon examination, a meticulous search for hernias (particularly in the inguinal and femoral regions) should be conducted.The diagnosis of small bowel obstruction is usually con-firmed with radiographic examination. The abdominal series consists of (a) a radiograph of the abdomen with the patient in a supine position, (b) a radiograph of the abdomen with the patient in an upright position, and (c) a radiograph of the chest with the patient in an upright position. The finding most specific for small bowel obstruction is the triad of dilated small bowel loops (>3 cm in diameter), air-fluid levels seen on upright films, and a paucity of air in the colon. The sensitivity of abdominal radiographs in the detection of small bowel obstruction ranges from 70% to 80%', 'The history and examination are often enough to make the diagnosis, but laboratory and imaging studies are helpful when the diagnosis is uncertain (Table 129-3). A WBC count greater than 10,000/mm3 is found in 89% of patients with appendicitis and 93% with perforated appendicitis. This criterion is met by 62% of abdominal pain patients without appendicitis. Urinalysis is done to rule out urinary tract infection, and x-rays of the chest or the kidney, ureter, and bladder (KUB) rule\n\nCBC with differential Urinalysis Amylase and lipase ALT, AST, GGT Flat and upright abdominal radiographs (KUB)\n\nAbdominal ultrasound CT scan of abdomen\n\nALT, Alanine aminotransferase; AST, aspartate aminotransferase; CBC, complete blood count; CT, computed tomography; GGT, γ-glutamyltransferase; KUB, kidney, ureter, bladder. *Perform when diagnosis remains in doubt.\n\nout lower lobe pneumonia masquerading as abdominal pain. Amylase, lipase, and liver enzymes are done to look for pancreatic or liver and gallbladder disease. The plain abdominal x-ray may reveal a calcified fecalith, which strongly suggests the diagnosis. When these studies are inconclusive, imaging is indicated with an abdominal ultrasound or CT scan, which may reveal the presence of an enlarged, thick-walled appendix with surrounding fluid. A diameter of more than 6 mm is considered diagnostic.\n\nTreatment of appendicitis is surgical. Simple appendectomy iscurative if performed before perforation. With perforation, a course of postoperative IV antibiotics is required. Broad-spectrumcoverage is necessary to cover the mixed bowel flora.', 'The physical examination complements the history. Orthostatic hypotension and reduced skin turgor indicate intravascular fluid loss. Pulmonary abnormalities raise concern for aspiration of vomitus. Abdominal auscultation may reveal absent bowel sounds with ileus. High-pitched rushes suggest bowel obstruction, whereas a succussion splash upon abrupt lateral movement of the patient is found with gastroparesis or pyloric obstruction. Tenderness or involuntary guarding raises suspicion of inflammation, whereas fecal blood suggests mucosal injury from ulcer, ischemia, or tumor. Neurologic disease presents with papilledema, visual field loss, or focal neural abnormalities. Neoplasm is suggested by palpation of masses or adenopathy.\n\nFor intractable symptoms or an elusive diagnosis, selected screening tests can direct clinical care. Electrolyte replacement is indicated for hypokalemia or metabolic alkalosis. Iron-deficiency anemia mandates a search for mucosal injury. Pancreaticobiliary disease is indicated by abnormal pancreatic or liver biochemistries, whereas endocrinologic, rheumatologic, or paraneoplastic etiologies are suggested by hormone or serologic abnormalities. If bowel obstruction is suspected, supine and upright abdominal radiographs may show intestinal air-fluid levels with reduced colonic air. Ileus is characterized by diffusely dilated air-filled bowel loops.\n\nCHAPTER 54 Nausea, Vomiting, and Indigestion', 'Patients may have anemia, FTT, and fever.\n\nMore than 50% of patients will have metastases at diagnosis. Signs include bone marrow suppression, proptosis, hepatomegaly, subcutaneous nodules, and opsoclonus/myoclonus.\n\nCT scan; fine-needle aspirate of tumor. Histologically appears as small, round, blue tumor cells with a characteristic rosette pattern.\n\nElevated 24-hour urinary catecholamines (VMA and HVA).\n\nBone scan and bone marrow aspirate.\n\nCBC, LFTs, coagulation panel, BUN/creatinine.\n\nLocal excision plus postsurgical chemotherapy and/or radiation.\n\nWilms’ tumor is associated\n\nA renal tumor of embryonal origin that is most commonly seen in children 2–5 years of age. Associated with Beckwith-Wiedemann syndrome (hemihy-hemihypertrophy.\n\npertrophy, macroglossia, visceromegaly), neurofibromatosis, and WAGR syndrome (Wilms’, Aniridia, Genitourinary abnormalities, mental Retardation).\n\nPresents as an asymptomatic, nontender, smooth abdominal mass.\n\nAbdominal pain, fever, hypertension, and microscopic or gross hematuria are seen.\n\nCBC, BUN, creatinine, and UA.\n\nAbdominal ultrasound.\n\nCT scans of the chest and abdomen are used to detect metastases.\n\nLocal resection and nephrectomy with postsurgical chemotherapy and radiation depending on stage and histology.\n\nIt is critical to distinguish between Ewing’s sarcoma and osteosarcoma (see Table 2.13-10).\n\nAn important aspect of every well-child visit. Commonly tested advice includes the following:', 'The abdominal examination should begin with inspection for the presence of uneven distention or an obvious mass. Auscultation should follow. The absence of bowel sounds or the presence of high-pitched localized bowel sounds points toward an ileus or intestinal obstruction. An umbilical venous hum may suggest the presence of portal hypertension, and a harsh bruit over the liver is heard rarely in patients with hepatocellular carcinoma or alcoholic hepatitis. Abdominal swelling caused by intestinal gas can be differentiated from swelling caused by fluid or a solid mass by percussion; an abdomen filled with gas is tympanic, whereas an abdomen containing a mass or fluid is dull to percussion. The absence of abdominal dullness, however, does not exclude ascites, because a minimum of 1500 mL of ascitic fluid is required for detection on physical examination. Finally, the abdomen should be palpated to assess for tenderness, a mass, enlargement of the spleen or liver, or presence of a nodular liver suggesting cirrhosis or tumor. Light palpation of the liver may detect pulsations suggesting retrograde vascular flow from the heart in patients with right-sided heart failure, particularly tricuspid regurgitation.\n\nAbdominal x-rays can be used to detect dilated loops of bowel sug gesting intestinal obstruction or ileus. Abdominal ultrasonography can detect as little as 100 mL of ascitic fluid, hepatosplenomegaly, a nodular liver, or a mass. Ultrasonography is often inadequate to detect retroperitoneal lymphadenopathy or a pancreatic lesion because of overlying bowel gas. If malignancy or pancreatic disease is suspected,', 'Although Ewing sarcoma can occur in almost any bone in the body, the femur and pelvis are the most common sites. In addition to local pain and swelling, clinical manifestations may include systemic symptoms, such as fever and weight loss.\n\nTissue biopsy is needed for a definitive diagnosis of sarcomas. Selection of the biopsy site is important and has implications for future surgical resection and radiation therapy. Under light microscopy, rhabdomyosarcoma and Ewing sarcoma appear as small, round, blue cell tumors. Osteosarcomas are distinguishable by the presence of osteoid substance.\n\nImmunohistochemical staining for muscle-specific proteins, such as actin and myosin, helps confirm the diagnosis of rhabdomyosarcoma. Two major histologic variants exist for rhabdomyosarcoma: embryonal and alveolar. Embryonal histologic variant is most common in younger children with head, neck, and genitourinary primary tumors. Alveolar histologic variant occurs in older patients and is seen most commonly in trunk and extremity tumors. Alveolar rhabdomyosarcoma often is characterized by specific translocations: t(2;13) or t(1;13). Metastatic evaluation for patients with rhabdomyosarcoma should include a computed tomography (CT) scan of the chest, abdomen, and pelvis; a bone scan; and bone marrow aspiration and biopsy. A lumbar puncture is required in patients with a parameningeal primary site.', 'Local resection and nephrectomy with postsurgical chemotherapy and radiation depending on stage and histology.\n\nIt is critical to distinguish between Ewing’s sarcoma and osteosarcoma (see Table 2.13-10).\n\nAn important aspect of every well-child visit. Commonly tested advice includes the following:\n\nT AB LE 2.1 3-1 0. Ewing’s Sarcoma vs. Osteosarcoma\n\nSarcoma (neuroectoderm); associated with chromosome 11:22 translocation. Osteoblasts (mesenchyme). Commonly seen in Caucasian male adolescents. Commonly seen in male adolescents. History/PE Local pain and swelling. Systemic symptoms (fever, anorexia, fatigue) are common. Local pain and swelling. Systemic symptoms are rare. Location Midshaft of long bones (femur, pelvis, f bula, humerus). Metaphyses of long bones (distal femur, proximal tibia, proximal humerus). Metastases to lungs in 20%. Leukocytosis, ↑ ESR. Lytic bone lesion with “onion skin” periosteal reaction on plain x-ray. ↑ alkaline phosphatase. “Sunburst” lytic bone lesions. Chest CT to rule out pulmonary metastases. Local excision, chemotherapy, and radiation. Local excision, chemotherapy. Origin Epidemiology Diagnosis Treatment\n\nKeep the water heater at < 48.8°C (< 120ºF).\n\nBabies should sleep on their backs without any stuffed animals or other toys in the crib (to ↓ the risk of SIDS).\n\nCar safety seats should be rear facing and should be placed in the back of the car (seats can face forward if the child is > 1 year of age and weighs > 20 lbs).', 'For all children with sarcoma, presence or absence of metastatic disease at presentation is the most important prognostic factor. The outlook remains poor for patients who have distant metastasis from Ewing sarcoma, rhabdomyosarcoma, or osteosarcoma at diagnosis. Patients with localized rhabdomyosarcomas in favorable sites have an excellent prognosis when treated with surgery followed by vincristine and actinomycin. In patients with osteosarcoma and Ewing sarcoma, another important prognostic factor is the degree of tumor necrosis after preoperative chemotherapy. In general, patients whose tumor specimens show a high degree (>90%) of necrosis following preoperative chemotherapy have an event-free survival rate greater than 80%. Patients who still have large amounts of viable tumor after presurgical chemotherapy have a much worse prognosis. The cure rate for patients with localized osteosarcoma and Ewing sarcoma is approximately 60% to 70%. Patients who have lung metastasis at diagnosis have a cure rate of approximately 30% to 35%. Patients with metastases to other bones have a poor prognosis.\n\nArndt CA, Rose PS, Folpe AL, et\xa0al: Common musculoskeletal tumors of childhood and adolescence, Mayo Clin Proc 87:475–487, 2012\n\nDavenport KP, Blanco FC, Sandler AD: Pediatric malignancies: neuroblas toma, Wilms tumor, hepatoblastoma, rhabdomyosarcoma and sacrococ cygeal teratoma, Surg Clin North Am 92:745–767, 2012\n\nKopp LM, Gupta P, Pelayo-Katsanis L, et\xa0al.: Late effects in adult survivors of pediatric cancer: a guide for the primary care physician, Am J Med 125:636–641, 2012', '. Treatment is a combination of chemotherapy and surgery.EWING’S SARCOMAEwing’s sarcoma is the second most common primary bone tumor in patients under 25 years of age. The typical presenta-tion is a tumor in the diaphysis of long bones, especially the femur. It can also be seen in the pelvis, the proximal tibia, and proximal humerus, and it is usually seen in young white males. It has a t(11:22) translocation and positive CD99. The patient may have pain and fever with an elevated sedimentation rate and WBC count; the condition may be confused with an infection. An “onion skin” periosteal reaction may be seen on radiographs. A large soft-tissue extension from the primary bone tumor may be seen, and histology reveals a small, round, blue cell tumor (Fig. 43-45). Diagnosis is confirmed with bone marrow biopsy specimen. Bone scan can identify multiple lesions. Treatment is chemotherapy and surgery or radiation therapy for spine or pelvic lesions.CARTILAGE-FORMING TUMORSChondrosarcomasChondrosarcomas typically occur in male patients over 40\xa0years of age, and they are the third most common primary bone malignancies. Primary chondrosarcomas can form clear cell, mesenchymal, or dedifferentiated neoplastic cartilage. Secondary chondrosarcomas may also develop in preexisting lesions such as exostoses or enchondromas. Pelvis, shoulder, and ribs are common locations. Chondroid or “popcorn” cal-cifications are typical on radiographs. Clear cell chondrosar-coma and mesenchymal chondrosarcoma occur in younger patients (second to fifth decades of life). Clear cell chondro-sarcomas are low-grade lesions that often affect the epiphyses', 'differentiation and a characteristic molecular signature (see later). Entities previously classified as primitive neuroectodermal tumor (PNET) and Askin tumor have been unified into the single category of Ewing sarcoma.\n\nEwing sarcoma accounts for approximately 10% of primary malignant bone tumors and follows osteosarcoma as the second most common bone sarcoma in children. Of all bone sarcomas, Ewing sarcomas have the youngest average age at presentation (80% are younger than 20 years). Boys are affected slightly more frequently than girls, and there is a predilection for Caucasians. The tumors usually arise in the diaphysis of long tubular bones but 20% are extraskeletal. They present as painful enlarging masses, and the affected site is frequently tender, warm, and swollen. Plain radiographs show a destructive lytic tumor with permeative margins that extends into the surrounding soft tissues. The characteristic periosteal reaction produces layers of reactive bone deposited in an onion-skin fashion.\n\nThe vast majority (85%) of Ewing sarcomas contain a balanced (11;22) (q24;q12) translocation generating in-frame fusion of the EWSR1 gene on chromosome 22 to the FLI1 gene on chromosome 11. Variant translocations fuse EWSR1 to other members of the ETS transcription factor family. How EWS fusion proteins contribute to transformation remains unsettled; effects on transcription, RNA splicing, and the cell cycle machinery have all been proposed. Similarly, the cell of origin still remains to be identified; the leading candidates are mesenchymal stem cells and primitive neuroectodermal cells.', 'A complete blood count and plain films may help identify patients with neuroblastoma. Calcification within abdominal neuroblastoma tumors is often observed on plain films of the abdomen.About 90% of neuroblastomas produce catecholamines (Vanillylmandelic acid; Homovanillic acid) that can be detected in the urine. Definitive diagnosis of neuroblastoma requires tissuefor light microscopic, electron microscopic, and immunohistologic examination. A computed tomography (CT) scan of thechest, abdomen, and pelvis; a bone scan and/or metaiodobenzylguanidine scan; bilateral bone marrow aspiration and biopsies;and urinary catecholamines complete the evaluation.\n\nThe abdominal presentation of neuroblastoma must be differentiated from Wilms tumor, which also presents as an abdominal flank mass. Ultrasound or CT examination usually differentiates the tumors. Periorbital ecchymoses from orbital metastases sometimes are mistaken for child abuse. Because children with bone marrow involvement may have anemia, thrombocytopenia, or neutropenia, leukemia is often considered in the differential.', 'Definitive diagnosis of osteosarcoma often is establishedby carefully placed needle biopsy. The presence of osteoidand immunohistochemical analysis confirms the diagnosisof osteosarcoma. The extent of the primary tumor shouldbe delineated carefully with magnetic resonance imaging(MRI) before starting chemotherapy. Osteosarcoma tends tometastasize to the lung, most commonly, and rarely to otherbones. Metastatic evaluation includes a chest CT scan and a bone scan.\n\nThe diagnosis of Ewing sarcoma is established with immunohistochemical analysis and cytogenetic and molecular diagnostic studies of the biopsy material. Ewing sarcoma is characterized by a specific chromosomal translocation, t(11;22), which is seen in 95% of tumors. MRI of the primary lesion should be performed to delineate extent of the lesion and any associated soft tissue mass. Metastatic evaluation involves a bone scan, chest CT scan, and bone marrow aspiration and biopsy.\n\nPatients with Ewing sarcoma may be misdiagnosed as having osteomyelitis; children with osteogenic sarcoma often are thought initially to have pain and swelling related to trauma. The differential diagnosis for rhabdomyosarcoma depends on the location of the tumor. Tumors of the trunk and extremities often present as a painless mass and may be initially thought to be benign tumors. Periorbital rhabdomyosarcoma may be misdiagnosed as orbital cellulitis, and other head and neck rhabdomyosarcoma may be confused with chronic infection of ears or sinuses. The differential diagnosis for intra-abdominal rhabdomyosarcoma includes other abdominal malignancies, such as Wilms tumor or neuroblastoma.', '. These include elevated levels of serum catecholamines (dopamine, norepinephrine) or urine catecholamine metabolites: vanillylmandelic acid (VMA) or homovanillic acid (HVA). Measurement of VMA and HVMA in serum and urine aids in the diagnosis and in monitoring ade-quacy of future treatment and recurrence. The minimum criterion for a diagnosis of neuroblastoma is based on one of the following: (a) an unequivocal pathologic diagnosis made from tumor tissue by light microscopy (with or without immunohistology, electron microscopy, or increased levels of serum catecholamines or uri-nary catecholamine metabolites); (b) the combination of bone marrow aspirate or biopsy containing unequivocal tumor cells and increased levels of serum catecholamines or urinary catechol-amine metabolites as described earlier.The patient should be evaluated by abdominal computer-ized tomography, which may show displacement and occasion-ally obstruction of the ureter of an intact kidney (Fig. 39-38). Prior to the institution of therapy, a complete staging workup should be performed. This includes radiograph of the chest, bone marrow biopsy, and radionuclide scans to search for metastases. Any abnormality on chest X-ray should be followed up with CT of the chest.Prognostic Indicators.\u2002A number of biologic variables have been studied in children with neuroblastoma. An open biopsy is required in order to provide tissue for this analysis. Hyperdip-loid tumor DNA is associated with a favorable prognosis, and Figure 39-38.\u2002Abdominal neuroblastoma arising from the right retroperitoneum (arrow).N-myc amplification is associated with a poor prognosis regard-less of patient age', 'Table 7.9 Common Malignant Neoplasms of Infancy and Childhood 10–14 Years of 0–4 Years of Age 5–9 Years of Age Age • Better survival or cure of many childhood tumors, so that much attention is now paid to minimizing the adverse delayed effects of chemotherapy and radiotherapy in survivors, including the development of second malignancies\n\nMany malignant pediatric neoplasms are histologically unique. In general, they tend to exhibit a primitive (embryonal) rather than pleomorphic-anaplastic microscopic appearance, and frequently they exhibit features of organogenesis specific to the site of tumor origin. Because of their primitive histologic appearance, many childhood tumors have been collectively referred to as small, round, blue-cell tumors. Sheets of cells with small, round nuclei characterize these tumors, which include neuroblastoma, lymphoma, rhabdomyosarcoma, Ewing sarcoma (peripheral neuroectodermal tumor), and some cases of Wilms tumor. Sufficient distinctive features usually are present to permit definitive diagnosis on the basis of histologic examination alone, but molecular studies are becoming increasingly useful, both for diagnosis and prognosis of childhood cancers. Three common tumors—neuroblastoma, retinoblastoma, and Wilms tumor—are described here to highlight the differences between pediatric tumors and those in adults.\n\nThe term neuroblastic includes tumors of the sympathetic ganglia and adrenal medulla that are derived from primordial neural crest cells populating these sites; neuroblastoma is the most important member of this family.']",Wilms tumor,Burkitt lymphoma,0.0,0.0,0.0,0.3274169060261682,0.5936410493468581,golden_007,D,A,False,True
"A 45-year-old man with HIV comes to the physician because of multiple lesions on his chest and lower extremities. The lesions have progressively increased in size and are not painful or pruritic. Current medications include abacavir, dolutegravir, and lamivudine. A photograph of the lesions is shown. His CD4+ T-lymphocyte count is 450/mm3 (normal ≥ 500/mm3). A skin biopsy shows multiple spindle-shaped cells and lymphocytic infiltrate. Which of the following is the most appropriate pharmacotherapy?","['the HIV-infected patient includes primary CNS lymphoma and, less commonly, TB or fungal or bacterial abscesses. The definitive diagnostic procedure is brain biopsy. However, given the morbidity rate that can accompany this procedure, it is usually reserved for the patient who has failed 2–4 weeks of empiric therapy for toxoplasmosis. If the patient is seronegative for T. gondii, the likelihood that a mass lesion is due to toxoplasmosis is <10%. In that setting, one may choose to be more aggressive and perform a brain biopsy sooner. Standard treatment is sulfadiazine and pyrimethamine with leucovorin as needed for a minimum of 4–6 weeks. Alternative therapeutic regimens include clindamycin in combination with pyrimethamine; atovaquone plus pyrimethamine; and azithromycin plus pyrimethamine plus rifabutin. Relapses are common, and it is recommended that patients with a history of prior toxoplasmic encephalitis receive maintenance therapy with sulfadiazine, pyrimethamine, and leucovorin as long as their CD4+ T cell counts remain <200 cells/μL. Patients with CD4+ T cell counts <100/μL and IgG antibody to Toxoplasma should receive primary prophylaxis for toxoplasmosis. Fortunately, the same daily regimen of a single double-strength tablet of TMP/SMX used for P. jiroveci prophylaxis provides adequate primary protection against toxoplasmosis. Secondary prophylaxis/maintenance therapy for toxoplasmosis may be discontinued in the setting of effective cART and increases in CD4+ T cell counts to >200/μL for 6 months.', 'Combination chemotherapy with low-dose doxorubicin, bleomycin, and vinblastine (ABV) and death from secondary infections is considerably more common. Thus, whenever possible one should avoid treatment regimens that may further suppress the immune system and increase susceptibility to opportunistic infections. Treatment is indicated under two main circumstances. The first is when a single lesion or a limited number of lesions are causing significant discomfort or cosmetic problems, such as with prominent facial lesions, lesions overlying a joint, or lesions in the oropharynx that interfere with swallowing or breathing. Under these circumstances, treatment with localized radiation, intralesional vinblastine, topical 9-cis-retinoic acid, or cryotherapy may be helpful. It should be noted that patients with HIV infection are particularly sensitive to the side effects of radiation therapy. This is especially true with respect to the development of radiation-induced mucositis; doses of radiation directed at mucosal surfaces, particularly in the head and neck region, should be adjusted accordingly. The use of systemic therapy, either IFN-α or chemotherapy, should be considered in patients with a large number of lesions or in patients with visceral involvement. The single most important determinant of response appears to be the CD4+ T cell count. This relationship between response rate and baseline CD4+ T cell count is particularly true for IFN-α. The response rate to IFN-α for patients with CD4+ T cell counts >600/μL is ~80%, while the response rate for patients with counts <150/μL is <10%. In contrast to the other systemic therapies, IFN-α provides an added advantage of having antiretroviral activity; thus, it may be the appropriate first choice for single-agent systemic therapy for early patients with disseminated disease. A variety of chemotherapeutic agents also have been shown to have activity against KS', 'FIGuRE 226-33 A. Decrease in the incidence of opportunistic infections and Kaposi’s sarcoma in HIV-infected individuals with CD4+ T cell counts <100/μL from 1992 through 1998. (Adapted and updated from FJ Palella et al: N Engl J Med 338:853, 1998, and JE Kaplan et al: Clin Infect Dis 30[S1]:S5, 2000, with permission.) B. Quarterly incidence rates of cytomegalovirus (CMV), Pneumocystis jiroveci pneumonia (PCP), and Mycobacterium avium complex (MAC) from 1995 to 2001. (From FJ Palella et al: AIDS 16:1617, 2002.) plained fever for >2 weeks, and any patient with a recent history of oropharyngeal candidiasis. The preferred regimen for prophylaxis is TMP/SMX, one double-strength tablet daily. This regimen also provides protection against toxoplasmosis and some bacterial respiratory pathogens. For patients who cannot tolerate TMP/SMX, alternatives for prophylaxis include dapsone plus pyrimethamine plus leucovorin, aerosolized pentamidine administered by the Respirgard II nebulizer, and atovaquone. Primary or secondary prophylaxis for PCP can be 1254 discontinued in those patients treated with cART who maintain good suppression of HIV (<50 copies/mL) and CD4+ T cell counts >200/μL for at least 3 months.', 'The skin of patients with HIV infection is often a target organ for drug reactions (Chap. 74). Although most skin reactions are mild and not necessarily an indication to discontinue therapy, patients may have particularly severe cutaneous reactions, including erythroderma, 1263 Stevens-Johnson syndrome, and toxic epidermal necrolysis, as a reaction to drugs—particularly sulfa drugs, nonnucleoside reverse transcriptase inhibitors, abacavir, amprenavir, darunavir, fosamprenavir, and tipranavir. Similarly, patients with HIV infection are often quite photosensitive and burn easily following exposure to sunlight or as a side effect of radiation therapy (Chap. 75).\n\nHIV infection and its treatment may be accompanied by cosmetic changes of the skin that are not of great clinical importance but may be troubling to patients. Yellowing of the nails and straightening of the hair, particularly in African-American patients, have been reported as a consequence of HIV infection. Zidovudine therapy has been associated with elongation of the eyelashes and the development of a bluish discoloration to the nails, again more common in African-American patients. Therapy with clofazimine may cause a yellow-orange discoloration of the skin and urine.', '. Treatment of recalcitrant lesions includes a variety of ther-apeutic options aimed at physically destroying the lesions by electrodessication, cryoablation, and pulsed dye laser therapy. Additional modalities such as H2-antagonists and zinc sulfate may have a role in augmenting the immune response and reduc-ing recurrence rates.Cutaneous Manifestations of Human Immunodeficiency VirusThe HIV-infected patient is significantly more susceptible to infectious and inflammatory skin conditions than the rest of the population.97 These skin disorders may be due to the HIV infection itself or from opportunistic infections secondary to immunosuppression. During early stages, nonspecific cutane-ous manifestations may occur. Acute retroviral syndrome occurs following inoculation in one-half to two-thirds of patients, and 30% to 50% of these patients can present with an acute viral exanthem.98 This is usually a morbilliform rash affecting the face, trunk, and upper extremities. Other skin changes, as well as common skin disorders with atypical features, can occur, including recurrent varicella zoster, hyperkeratotic warts, and seborrheic dermatitis. Condylomata acuminate and verrucae appear early; however, their frequency and severity do not change with disease progression.Late-presenting cutaneous manifestations include chronic herpes simplex virus (HSV), cytomegalovirus, and, to a lesser extent, molluscum contagiousum, which is typically treatable with imiquimod. HSV is the most common viral infection in the patient with HIV, and is more likely to display atypical fea-tures and less likely to spontaneously resolve in these patients.99 Mycobacterial infections and mucocutaneous candidiasis also occur', '. Treatment of AIDS-associated Kaposi’s sarcoma is with antiviral therapy, and many patients experience a dramatic treatment response.176,177 Those individuals who do not respond and have limited muco-cutaneous disease may benefit from cryotherapy, photodynamic therapy, radiation therapy, intralesional injections, and topical therapy. Surgical biopsy is important for disease diagnosis, but given the high local recurrence and the fact that Kaposi’s sar-coma represents more of a systemic rather than local disease, the benefit of surgery is limited and generally should not be pursued except for palliation.Dermatofibrosarcoma ProtuberansThis rare, low-grade sarcoma of fibroblast origin commonly afflicts individuals during their third decade of life. It has low distant metastatic potential, but it behaves aggressively locally with finger-like extensions. Tumor depth is the most important prognostic variable. Presentation is characteristically a slow-growing, asymptomatic, violaceous plaque involving the trunk, head, neck, or extremities (Fig. 16-18). Nearly all cases are posi-tive for CD34 and negative for factor XIIIa.178,179 Treatment is wide local excision with 3-cm margins down to deep underly-ing fascia or Mohs microsurgery in cosmetically sensitive areas where maximum tissue preservation will benefit.180 No nodal dissection is needed, and both approaches provide similar local control.181 Some clinicians have used radiation therapy and bio-logic agents (imatinib) as adjuvant therapy with some success in patients with advanced disease. Local recurrence occurs in 50% to 75% of cases, usually within 3 years of treatment. Thus, clini-cal follow-up is important', 'Extramammary Paget’s disease is an uncommon apocrine malignancy arising from stem cells of the epidermis that are characterized histologically by the presence of Paget cells. These tumors present as moist erythematous patches on anogenital or axillary skin of the elderly. Outcomes are generally good with site-directed surgery, and 5-year disease specific survival is approximately 95% with localized disease. Advanced age and extensive disease at presentation are factors that confer diminished prognosis. RT or topical imiquimod can be considered for more extensive disease. Local management may be challenging because these tumors often extend far beyond clinical margins; surgical excision with MMS has the highest cure rates. Similarly, MMS is the treatment of choice in other rare cutaneous tumors with extensive subclinical extension such as dermatofibromasarcoma protuberans.\n\nKaposi’s sarcoma (KS) is a soft tissue sarcoma of vascular origin that is induced by the human herpesvirus 8. The incidence of KS increased dramatically during the AIDS epidemic, but has now decreased tenfold with the institution of highly active antiretroviral therapy.\n\nCarl V. Washington, MD, and Hari Nadiminti, MD, contributed to this chapter in the 18th edition, and material from that chapter is included here. Claudia Taylor, MD, and Steven Kolker, MD, provided valued feedback and suggested many improvements to this chapter.\n\nEverett E. Vokes', 'An alternative strategy for cure has been highlighted in a single HIV patient who underwent hematopoietic stemcell transplantation (HSCT) for treatment of leukemia in Berlin (hence referred to as the Berlin patient). By using a stemcell donor who was homozygous for the CCR5Δ32 coreceptor mutation, the patient was reconstituted with immune cells resistant to viral propagation. The patient’s CD4 Tcell counts rebounded and he was found to be free of any evidence of HIV infection (or leukemia) following cessation of antiretroviral therapy posttransplant. He has remained so for more than 5 years, suggesting that he has been cured of infection. In view of the large number of infected individuals worldwide, the risk of complications with HSCT, and rarity of HLAmatched CCR5deletant donors, this will never be a practical approach for cure at the population level. Moreover, there is a risk of progression or reinfection posttransplant by CXCR4tropic viral variants. This outcome does, however, dramatically establish that eradication of a latency reservoir (in this case by inductive chemoirradiation therapy for leukemia) combined with blockade of viral replication—whether by genetic or therapymediated interventions— might achieve a permanent cure.\n\n13-36 In the course of infection HIV accumulates many mutations, which can result in the outgrowth of drug-resistant variants.', 'FIGuRE 226-42 Chest x-ray of a patient with AIDS and pulmonary Kaposi’s sarcoma. The characteristic findings include dense bilateral lower lobe infiltrates obscuring the heart borders and pleural effusions.\n\nA diagnosis of KS is based on biopsy of a suspicious lesion. Histologically one sees a proliferation of spindle cells and endothelial cells, extravasation of red blood cells, hemosiderin-laden macrophages, and, in early cases, an inflammatory cell infiltrate. Included in the differential diagnosis are lymphoma (particularly for oral lesions), bacillary angiomatosis, and cutaneous mycobacterial infections.\n\nManagement of KS (Table 226-18) should be carried out in consultation with an expert since definitive treatment guidelines do not exist. In the majority of cases, effective cART will go a long way in achieving control. Antiretroviral therapy has been associated with the spontaneous regression of KS lesions. Paradoxically, it has also been associated with the initial appearance of KS as a form of IRIS. For patients in whom tumor persists or is compromising vital functions or in whom control of HIV replication is not possible, a variety of options exist. In some cases, lesions remain quite indolent, and many of these patients can be managed with no specific treatment. Fewer than 10% of AIDS patients with KS die as a consequence of their malignancy,\n\nGood Risk (Stage 0): Poor Risk (Stage 1): Parameter All of the Following Any of the Following\n\nHuman Immunodeficiency Virus Disease: AIDS and Related Disorders aDefined as unexplained fever, night sweats, >10% involuntary weight loss, or diarrhea persisting for more than 2 weeks.\n\nObservation and optimization of antiretroviral therapy\n\nSingle or limited number of lesions', '. HSV is the most common viral infection in the patient with HIV, and is more likely to display atypical fea-tures and less likely to spontaneously resolve in these patients.99 Mycobacterial infections and mucocutaneous candidiasis also occur. Bacterial infections such as impetigo and folliculitis may be more persistent and widespread.Malignant lesions such as Kaposi’s sarcoma occur in less than 5% of HIV-infected patients in the United States, although the worldwide prevalence in acquired immunodeficiency syn-drome (AIDS) patients exceeds 30%. Kaposi’s sarcoma is a vas-cular neoplasm that can affect cutaneous and visceral tissues. While the rates of Kaposi’s sarcoma development have sharply declined since the widespread use of antiretroviral therapy, the rates of other cutaneous malignancies have remained stable. The risk of an HIV-infected patient developing a cutaneous malig-nancy is about 5.7%, with basal cell carcinoma being the most common type encountered.100With regard to general surgical considerations in HIV patients, contributing related morbidities such as malnutrition, decreased CD4 count, and presence of opportunistic infection may result in delayed and attenuated wound healing capacity.101BENIGN TUMORSHemangiomaHemangiomas are benign vascular tumors that arise from the proliferation of endothelial cells that surround blood-filled cavities. They occur in about 4% of children by 1 year of age. Their natural history is typically presentation shortly after birth, a period of rapid growth during the first year, and then gradual involution over childhood in more than 90% of cases. These hemangiomas are generally managed nonsurgically prior to involution. Occasionally, during the rapid growth phase, the lesions can obstruct the airway, GI tract, vision, and musculo-skeletal function']",Alpha-interferon,Alpha-interferon,1.0,0.49999999995,0.0,0.9318181818181819,0.5731785335546687,golden_008,C,C,True,True
"A two-month-old female presents to the emergency department for difficulty feeding. The patient was born at 38 weeks gestation to a 29-year-old primigravid via vaginal delivery. The newborn period has thus far been uncomplicated. The patient has been exclusively breastfed since birth. Her parents report that feeding had previously seemed to be going well, and the patient has been gaining weight appropriately. Over the past several days, the patient’s mother has noticed that the patient seems to tire out before the end of the feeding. She has also noticed that the patient begins to appear short of breath and has a bluish discoloration of her lips. The patient’s height and weight were in the 20th and 10th percentile at birth, respectively. Her current height and weight are in the 20th and 15th percentiles, respectively. Her temperature is 98.0°F (36.7°C), blood pressure is 60/48 mmHg, pulse is 143/min, and respirations are 40/min. On physical exam, the patient is in no acute distress and appears well developed. A systolic crescendo-decrescendo murmur can be heard at the left upper sternal border. Her abdomen is soft, non-tender, and non-distended. During the abdominal exam, the patient begins crying and develops cyanosis of the perioral region.

Which of the following is the best initial test to diagnose this patient’s condition?","[""Gynecol 141:646, 1981\n\nClark SL, Sabey P, Jolley K: Nonstress testing with acoustic stimulation and amnionic luid volume assessment: 5973 tests without unexpected fetal death. Am J Obstet Gynecol 160:694, 1989\n\nCousins LM, Poelder DM, Faron 5, et al: Nonstress testing at ;32.0 weeks' gestation: a randomized trial comparing diferent assessment criteria. Am J Obstet (4):311.e1, 2012\n\nDawes GS: Breathing before birth in animals and man. An essay in medicine.\n\nPhysiol Med 290:557, 1974\n\nDawes GS, Fox HE, Leduc BM, et al: Respiratory movements and rapid eye movement sleep in the foetal lamb. J Physiol 220: 119, 1972\n\nDayal AK, Manning FA, Berek DJ, et al: Fetal death after normal biophysical proile score: an eighteen year experience. m J Obstet Gynecol 181:o1231, 1999\n\nDevoe LD: Antenatal fetal assessment: contraction stress test, nonstress test, vibroacoustic stimulation, amniotic fluid volume, biophysical proile, and modified biophysical profile-an overview. Semin Perinatol 32(4):247, 2008\n\nDevoe LD, Castillo A, Sherline DM: The nonstress test as a diagnostic test: a critical reappraisal. Am J Obstet GynecoIo152:1047, 1986\n\nDevoe LD, McKenzie J, Searle NS, et al: Clinical sequelae of the extended nonstress test. m J Obstet GynecoIo151:1074, 1985"", ""he MCA peak systolic velocity is followed serially, and values are plotted on a curve like the one shown in Figure 15-1. If the velocity is between 1.0 and 1.5 MoM and the slope is rising-such that the value is approaching 1.5 Movf-surveillance is generally increased to weekly Doppler interrogation. If the MCA peak systolic velocity exceeds 1.5 \\10M and the gestational age is younger than 34 or 35 weeks, fetal blood sampling should be considered and followed by fetal transfusion if needed (Society for Maternal-Fetal Medicine, 2015a). he false-positive rate of MCA peak systolic velocity increases signiicantly beyond 34 weeks, due to the normal augmentation in cardiac output that develops at this gestational age (Moise, 2008; Zimmerman, 2002).\n\nAmnionic Fluid Spectral Analysis. This test is included for historical interest. More than 50 years ago, Liley (1961) demonstrated the utility ofamnionic fluid spectral analysis to measure bilirubin concentration and to thereby estimate hemolysis severity. Amnionic luid bilirubin concentration was measured by a spectrophotometer and was represented as the change in optical density absorbance at 450 nm-10D450. The likelihood of fetal anemia was determined by plotting the 10D45o value on a graph that was divided into zones. hese zones roughly correlated with fetal hemoglobin concentration, and thus with anemia severity. he original Liley graph was valid from 27 to 42 weeks' gestation and was subsequently modiied by Queenan (1993) to include gestational ages as early as 14 weeks. However, the amnionic luid bilirubin level is normally high in midpregnancy, limiting the reliability ofthis technique."", 'American Academy of Pediatrics and American College of Obstetricians and Gynecologists: Guidelines for perinatal care, 8th ed. Elk Grove Village, AAP,o2017\n\nAmerican College of Obstetricians and Gynecologists: Antepartum fetal surveillance. Practice Bulletin No. 145, July 2014, Reairmed 2016\n\nBadalian 55, Chao CR, Fox HE, et al: Fetal breathing-related nasal fluid flow velocity in uncomplicated pregnancies. Am J Obstet Gynecol 169:563, 1993\n\nBaschat AA: Opinion and review: Doppler application in the delivery timing in the preterm growth-restricted fetus: another step in the right direction. Ultrasound Obstet Gynecol 23: 11o8, 2004\n\nBaschat AA, Cosmi E, Bilardo C, et al: Predictors of neonatal ourcome in earlyonset placental dysfunction. Obstet Gynecol 109:253, 200\n\nBilardo CM, Wolf H, Stigter RH, et al: Relationship between monitoring parameters and perinatal outcome in severe, early intrauterine growth restriction. Ultrasound Obstet Gynecol 23: 199, 2004\n\nBourgeois FJ, Thiagarajah 5, Harbert GM J r: The signiicance of fetal heart rate decelerations during nonstress testing. Am J Obstet Gynecol 150:213, 1984 Brown R, Patrick J: he nonstress test: how long is enough? Am J Obstet\n\nGynecol 141:646, 1981\n\nClark SL, Sabey P, Jolley K: Nonstress testing with acoustic stimulation and amnionic luid volume assessment: 5973 tests without unexpected fetal death. Am J Obstet Gynecol 160:694, 1989', 'TOCO=IT.\n\nFIGURE 17-8 Nonreactive nonstress test (left side of tracing) followed by contraction stress test showing mild, late decelerations (right side of tracing). Cesarean delivery was performed, and the severely acidemic fetus could not be resuscitated.\n\nheart rate decelerations during nonstress tests were not a sign of fetal compromise. he American College of Obstetricians and Gynecologists (2016) has concluded that variable decelerations, if nonrepetitive and brief-less than 30 seconds-do not indicate fetal compromise or the need for obstetrical intervention. In contrast, repetitive variable decelerations-at least three in 20 minutes-even if mild, have been associated with a greater risk of cesarean delivery for fetal distress. Decelerations lasting 1 minute or longer have been reported to have an even worse prognosis (Bourgeois, 1984; Druzin, 1981; Pazos, 1982).\n\nHoskins and associates (1991) attempted to reine interpretation of testing that shows variable decelerations by adding sonographic estimation of amnionic luid volume. The incidence of cesarean delivery for intrapartum fetal distress progressively rose concurrently with the severity of variable decelerations and decline of amnionic luid volume. Severe variable decelerations during a nonstress test plus an amnionic luid index (AFI) ;5 em resulted in a 75-percent cesarean delivery rate. Fetal distress in labor, however, also frequently developed in those pregnancies with variable decelerations but with normal amounts of amnionic luid. Similar results were reported by Grubb and Paul (1992).', ""During scanning, because of theoretical temperature elevation in tissues exposed to pulsed Doppler beam, this modality is applied only when needed for additional diagnostic purposes. M-mode should be used to document cardiac activity and measure the rate (Lane, 2013). Finding of an IUP and cardiac activity lowers subsequent miscarriage rates (Siddiqi, 1988).\n\nIn addition to the diagnostic parameters of Table 18-3, other softer sonographic markers may portend early pregnancy failure. Values for yolk sac diameters (measured inner-to-inner ring) for each gestational week in normal pregnancy have been established. Yolk sac diameters ::6 mm in pregnancies < 10 weeks' gestation are suspicious for pregnancy failure (Berdahl, 2010; Lindsay, 1992). The fetal heart rate in the irst trimester rises from 110 to 130 beats per minute (bpm) at 6 weeks' gestation to 160 to 170 bpm at 8 weeks (Achiron, 1991; Rauch, 2009). A slower heart rate is unfavorable, especially those <85 bpm (Laboda, 1989; Stefos, 1998). Even with cardiac activity, fetuses with a small MSD may presage embryonic loss. Speciically, a diference <5 mm between the MSD and CRL values raises concern (Bromley, 1991; Dickey, 1992). Last, subchorionic hematoma, that is, blood collected between the chorion and uterine wall, often accompanies threatened miscarriage. Studies are contradictory as to its association with ultimate pregnancy loss (Pedersen, 1990; Stabile, 1989; Tuuli, 2011). Bennett and associates (1996) noted that miscarriage risk correlated with larger hematoma size, older maternal age, and bleeding at a gestational age :;8 weeks."", 'Echocardiography.\n\nCXR may show a narrow heart base, absence of the main pulmonary artery segment (“egg-shaped silhouette”), and ↑ pulmonary vascular markings.\n\nStart IV PGE1 to maintain or open the PDA.\n\nIf surgery is not feasible within the first few days of life or if the PDA cannot be maintained with prostaglandin, perform balloon atrial septostomy to create or enlarge an ASD.\n\nSurgical correction (arterial or atrial switch).\n\nTetralogy of Fallot\n\nConsists of pulmonary stenosis, overriding aorta, RVH, and VSD. The most common cyanotic congenital heart disease in children. Early cyanosis results from right-to-left shunting across the VSD. As right-sided pressures ↓ in the weeks after birth, the shunt direction reverses and cyanosis may ↓. If the degree of pulmonary stenosis is severe, the right-sided pressures may remain high and cyanosis may worsen over time. Risk factors include maternal PKU and DiGeorge syndrome.\n\nPresents in infancy or early childhood with dyspnea and fatigability. Cyanosis is often not present at birth but develops over the first two years of life; the degree of cyanosis often reﬂects the extent of pulmonary stenosis.\n\nInfants are often asymptomatic until 4–6 months of age, when CHF may develop and may manifest as diaphoresis with feeding or tachypnea.\n\nChildren often squat for relief (↑ systemic vascular resistance) during hypoxemic episodes (“tet spells”).\n\nHypoxemia may lead to FTT or mental status changes.\n\nExam reveals a systolic ejection murmur at the left upper sternal border (right ventricular outﬂow obstruction), a right ventricular heave, and a single S2.\n\nEchocardiography and catheterization.', 'Other congenital heart defects that allow complete mixing of systemic and pulmonary venous return can present with cyanosis depending on the amount of pulmonary blood flow that is present. Many cyanotic heart lesions present in the neonatal period (Table 144-1).\n\nTetralogy of Fallot is the most common cyanotic congenital heart defect, representing about 10% of all congenital heart defects (Fig. 144-1). There are four structural defects: ventricular septal defect (VSD), pulmonary stenosis, overriding aorta, and right ventricular hypertrophy. Tetralogy of Fallot is due to abnormal septation of the truncus arteriosus into the aorta and pulmonary artery that occurs early in gestation (3to 4 weeks). The VSD is large and the pulmonary stenosis is most commonly subvalvular or infundibular. It may also be valvular, supravalvular, or, frequently, a combination of levels of obstruction.\n\nInfants initially may be acyanotic. A pulmonary stenosis murmur is the usual initial abnormal finding. The amount of right-to-left shunting at the VSD (and the degree of cyanosis) increases as the degree of pulmonary stenosis increases. With increasing severity of pulmonary stenosis, the murmur becomes shorter and softer. In addition to varying degrees of cyanosis and a murmur, a single S2 and right ventricular impulse at the left sternal border are typical findings.\n\nWhen hypoxic (Tet) spells occur, they are usually progressive. During a spell, the child typically becomes restless and agitated and may cry inconsolably. An ambulatory toddler may\n\nASD, Atrial septal defect; AV, atrioventricular; AVM, arteriovenous malformation; PDA, patent ductus arteriosus; VSD, ventricular septal defect.', 'Echocardiography and color ﬂow Doppler are diagnostic.\n\nCXR in young children may demonstrate cardiomegaly and pulmonary congestion.\n\nIn older children, the following compensatory changes may be seen: LVH on ECG; the “3” sign on CXR due to preand postdilatation of the coarctation segment with aortic wall indentation; and “rib notching” due to collateral circulation through the intercostal arteries.\n\nIf severe coarctation presents in infancy, the ductus arteriosus should be kept open with prostaglandin E1 (PGE1).\n\nSurgical correction or balloon angioplasty (controversial).\n\nMonitor for restenosis, aneurysm development, and aortic dissection.\n\nTransposition of the Great Vessels\n\nThe most common cyanotic congenital heart lesion in the newborn. In this condition, the aorta is connected to the right ventricle and the pulmonary artery to the left ventricle, creating parallel pulmonary and systemic circulations. Without a septal defect or a PDA, it is incompatible with life. Risk factors include diabetic mothers and, rarely, DiGeorge syndrome (see the mnemonic CATCH 22).\n\n■Critical illness and cyanosis typically occur immediately after birth. Reverse differential cyanosis may be seen if left ventricular outﬂow tract obstruction (e.g., coarctation, aortic stenosis) is also present.\n\n■Exam reveals tachypnea, progressive hypoxemia, and extreme cyanosis. Some patients have signs of CHF, and a single loud S2 is often present. There may not be a murmur if no VSD is present.\n\nEchocardiography.\n\nCXR may show a narrow heart base, absence of the main pulmonary artery segment (“egg-shaped silhouette”), and ↑ pulmonary vascular markings.', '. This results from the relatively fixed left-to-right shunt throughout all phases of the cardiac cycle. A diastolic flow murmur indicating increased flow across the tricuspid valve may be discerned, and frequently, an ejection flow mur-mur can be heard across the pulmonary valve. A right ventricu-lar heave and increased intensity of the pulmonary component of the second heart sound indicates pulmonary hypertension.Chest radiographs in the patient with an ASD demonstrate increased pulmonary vascularity, with prominent hilar mark-ings and cardiomegaly. The electrocardiogram shows right axis deviation with an incomplete bundle-branch block. When right bundle-branch block is associated with a leftward or superior axis, an AV canal defect should be strongly suspected.Diagnosis is clarified by two-dimensional echocardiogra-phy (Fig. 20-1A,C), and use of color-flow mapping facilitates an understanding of the physiologic derangements created by the defects. Older children and adults with unrepaired ASDs may present with stroke or systemic embolism from paradoxical embolism or atrial arrhythmias from dilation of the right atrium.Echocardiography also enables the clinician to estimate the amount of intracardiac shunting, and it can demonstrate the degree of mitral regurgitation in patients with ostium primum defects. With the addition of an agitated saline injection (bubble study), it can also assist in the detection of sinus venosus defects.The advent of two-dimensional echocardiography with color-flow Doppler has largely superseded the use of cardiac catheterization because the ASD can be well defined by echo-cardiography alone', '. The holosystolic murmur of tricuspid regurgitation may accompany severe PS, especially in the presence of congestive heart failure. Cyanosis usually reflects right-to-left shunting through a patent foramen ovale or ASD. In patients with supravalvular or peripheral pulmonary arterial stenosis, the murmur is systolic or continuous and is best heard over the area of narrowing, with radiation to the peripheral lung fields.', 'Echocardiography has become the most important noninvasive tool in the diagnosis and management of cardiac disease,providing a full anatomic evaluation in most congenital heartdefects (Fig. 139-4). Physiologic data on the direction of bloodflow can be obtained with the use of pulsed, continuous wave,and color flow Doppler. Imaging from multiple views providesan assessment of spatial relationships. Three-dimensional (3D)and four-dimensional (4D) imaging now allows reconstruction of the heart and manipulation of the images to providemore detail, especially with regard to valve structure and function. Prenatal or fetal echocardiography can diagnose congenital heart disease by 18 weeks of gestation and allows for delivery of the infant at a tertiary care hospital, improving thetimeliness of therapy. Many congenital heart defects now aresurgically repaired based on the echocardiogram without needfor cardiac catheterization.\n\nFigure 139-4 Four-chamber echocardiogram of an atrial septal defect. The defect margins are identified by the two arrows. LA, Left atrium; LV, left ventricle; RA, right atrium; RV, right ventricle.\n\nTransesophageal echocardiography (TEE) provides better imaging when transthoracic imaging is inadequate. It is used intraoperatively to assess results and cardiac function after surgery. TEE and intracardiac echocardiography are used to guide interventional catheterization and radiofrequency ablation of dysrhythmias.', ""Traditionally, detection of congenital cardiac anomalies is more challenging than for anomalies of other organ systems.\n\n40 percent of those with major cardiac anomalies before 22 weeks' gestation, and specialized sonography may identiy 80 percent (Romosan, 2009; Trivedi, 2012). For selected anoma lies, prenatal detection may improve neonatal survival. his requiring prostaglandin infusion after birth to keep the duc tus arteriosus open (Franklin, 2002; Mahle, 2001; Tworetzky, 2001).\n\nStandard cardiac assessment includes a four-chamber view, evaluation of rate and rhythm, and evaluation of the left and right ventricular outlow tracts (Figs. 10-27 and 10-28A-C).\n\nExamination of the cardiac outflow tracts aids detection of abnormalities that might not be appreciated in the four-cham ber view. hese include tetralogy of Fallot, transposition of the great vessels, and truncus arteriosus.\n\nheour-chamber view is a transverse image of the fetal tho rax at a level immediately above the diaphragm. It allows evalu ation of cardiac size, position in the thorax, cardiac axis, atria and ventricles, foramen ovale, atrial septum primum, interven tricular septum, and atrioventricular valves (see Fig. 10-27).\n\nhe atria and ventricles should be similar in size, and the apex of the heart should form a 45-degree angle with the left anterior chest wall. Abnormalities of cardiac axis are frequently encoun tered with structural cardiac anomalies and occur in more than a third (Shipp, 1995)."", '. As LV dys-function progresses, evidence of congestive heart failure occurs.The chest radiograph is variable but may show dilatation of the aortic root, and the ECG often demonstrates LV hypertro-phy. Echocardiography with Doppler flow is extremely useful in establishing the diagnosis, as well as quantifying the transvalvular gradient. Furthermore, echocardiography can facilitate evaluation for the several associated defects that can be present in critical neonatal AS, including mitral stenosis, LV hypoplasia, LV endo-cardial fibroelastosis, subaortic stenosis, VSD, or coarctation. The presence of any or several of these defects has important impli-cations related to treatment options for these patients. Although cardiac catheterization is not routinely performed for diagnostic purposes, it can be invaluable as part of the treatment algorithm if the lesion is amenable to balloon valvotomy. Magnetic resonance imaging (MRI) is another very useful technique for assessing the adequacy of the left-sided structures and is increasingly utilized to determine candidacy for biventricular repairs.Treatment.\u2002As alluded to previously, the first decision that must be made in the neonate with critical LVOT obstruction is whether the patient is a candidate for biventricular or univen-tricular repair. Central to this decision is assessment of the degree of hypoplasia of the LV and other left-sided structures. Alsoufi and colleagues25 have described a rational approach to the neonate with critical LVOT obstruction. The options vary depending on whether the infant follows a single or a 3biventricular pathway. The options for a single ventricle include the Norwood operation, a hybrid strategy (initial ductal stent and bilateral pulmonary artery bands followed by later completion of the Norwood operation) or heart transplantation', 'Figure 143-2 Atrial septal defect. AO, Aorta; LA, left atrium; LV, left ventricle; PA, pulmonary artery; RA, right atrium; RV, right ventricle.\n\nDuring the embryologic development of the heart, a septum grows toward the endocardial cushions to divide the atria. Failure of septal growth or excessive reabsorption of tissue leads to ASDs (Fig. 143-2). ASDs represent approximately 10% of all congenital heart defects. A secundum defect, with the hole in the region of the foramen ovale, is the most common ASD. A primum ASD, located near the endocardial cushions, may be part of a complete atrioventricular canal defect or may be present with an intact ventricular septum. The least common ASD is the sinus venosus defect, which may be associated with anomalous pulmonary venous return.\n\nThe pathophysiology and amount of shunting depend on thesize of the defect and the relative compliance of the both ventricles. Even with large ASDs and significant shunts, infants andchildren are rarely symptomatic. A prominent right ventricular impulse at the left lower sternal border (LLSB) often can bepalpated. A soft (grade I or II) systolic ejection murmur in the region of the right ventricular outflow tract and a fixed split S2 (due to overload of the right ventricle with prolonged ejectioninto the pulmonary circuit) are often audible. A larger shuntmay result in a mid-diastolic murmur at the LLSB as a result ofthe increased volume passing across the tricuspid valve.\n\nECG and chest x-ray findings reflect the increased blood flow through the right atrium, right ventricle, pulmonary arteries,']",Echocardiogram,Echocardiogram,1.0,0.29965034964435666,0.0,1.0,0.5992711443033619,golden_009,D,D,True,True
"A 35-year-old female presents to the emergency room complaining of diarrhea and dehydration. She has been experiencing severe watery diarrhea for the past 3 days. She reports that she has been unable to leave the bathroom for more than a few minutes at a time. She noticed earlier today that there was some blood on her toilet paper after wiping. She recently returned from a volunteer trip to Yemen where she worked at an orphanage. Her past medical history is notable for psoriasis for which she takes sulfasalazine. The patient drinks socially and does not smoke. Her temperature is 99°F (37.2°C), blood pressure is 100/55 mmHg, pulse is 130/min, and respirations are 20/min. Mucus membranes are dry. Her eyes appear sunken. Capillary refill is 4 seconds. The patient is started on intravenous fluid resuscitation. Which of the following processes is capable of transmitting the genetic material for the toxin responsible for this patient’s condition?","['Vibrio organisms are noninvasive but cause disease by producing a toxin that interferes with the absorptive function of enterocytes. Flagellar proteins, which are involved in motility and attachment, are necessary for efficient bacterial colonization, and a secreted metalloproteinase that also has hemagglutinin activity is important for bacterial detachment and shedding in the stool. However, it is the preformed enterotoxin, cholera toxin, which causes disease. The toxin, which is composed of five B subunits that direct endocytosis and a single active A subunit, is delivered to the endoplasmic reticulum by retrograde transport. A fragment of the A subunit is transported from the endoplasmic reticulum lumen into the cytosol, where it interacts with cytosolic ADP ribosylation factors to ribosylate and activate the G protein Gsα. This stimulates adenylate cyclase, and the resulting increases in intracellular cyclic adenosine monophosphate (cAMP) open the cystic fibrosis transmembrane conductance regulator (CFTR), which releases chloride ions into the lumen. This creates an osmotic gradient that draws water into the lumen, leading to massive secretory diarrhea. Remarkably, mucosal biopsy specimens show only minimal morphologic alterations.\n\nMost exposed individuals are asymptomatic or suffer only mild diarrhea. Those with severe disease have an abrupt onset of watery diarrhea and vomiting after an incubation period of 1 to 5 days. The volume of diarrhea may reach 1 L per hour, leading to dehydration, hypotension, electrolyte imbalances, muscular cramping, anuria, shock, loss of consciousness, and death. Most deaths occur within the first 24 hours of presentation. Although the mortality rate for severe cholera is 50% to 70% without treatment, fluid replacement can save more than 99% of patients.', 'V. cholerae.\n\nOnce established in the human small bowel, the organism produces cholera toxin, which consists of a monomeric enzymatic moiety (the A subunit) and a pentameric binding moiety (the B subunit). The B pen-tamer binds to GM1 ganglioside, a glycolipid on the surface of epithelial cells that serves as the toxin receptor and makes possible the delivery of the A subunit to its cytosolic target. The activated A subunit (A1) irreversibly transfers ADP-ribose from nicotinamide adenine dinucleotide to its specific target protein, the GTP-binding regulatory component of adenylate cyclase. The ADP-ribosylated G protein upregulates the activity of adenylate cyclase; the result is the intracellular accumulation of high levels of cyclic AMP. In intestinal epithelial cells, cyclic AMP inhibits the absorptive sodium transport system in villus cells and activates the secretory chloride transport system in crypt cells, and these events lead to the accumulation of sodium chloride in the intestinal lumen. Because water moves passively to maintain osmolality, isotonic fluid accumulates in the lumen. When the volume of that fluid exceeds the capacity of the rest of the gut to resorb it, watery diarrhea results. Unless the wasted fluid and electrolytes are adequately replaced, shock (due to profound dehydration) and acidosis (due to loss of bicarbonate) follow. Although perturbation of the adenylate cyclase pathway is the primary mechanism by which cholera toxin causes excess fluid secretion, cholera toxin also enhances intestinal secretion via prostaglandins and/or neural histamine receptors.\n\nThe V. cholerae genome comprises two circular chromosomes.', 'Normal peristalsis is the major mechanism for clearance of bacteria from the proximal small intestine. When intestinal motility is impaired (e.g., by treatment with opiates or other antimotility drugs, anatomic abnormalities, or hypomotility states), the frequency of bacterial overgrowth and infection of the small bowel with enteric pathogens is increased. Some patients whose treatment for Shigella infection consists of diphenoxylate hydrochloride with atropine (Lomotil) experience prolonged fever and shedding of organisms, while patients treated with opiates for mild Salmonella gastroenteritis have a higher frequency of bacteremia than those not treated with opiates.\n\nBoth cellular immune responses and antibody production play important roles in protection from enteric infections. Humoral immunity to enteric pathogens consists of systemic IgG and IgM as well as secretory IgA. The mucosal immune system may be the first line of defense against many gastrointestinal pathogens. The binding of bacterial antigens to the luminal surface of M cells in the distal small bowel and the subsequent presentation of antigens to subepithelial lymphoid tissue lead to the proliferation of sensitized lymphocytes. These lymphocytes circulate and populate all of the mucosal tissues of the body as IgAsecreting plasma cells.\n\nHost genetic variation influences susceptibility to diarrheal diseases. People with blood group O show increased susceptibility to disease due to V. cholerae, Shigella, E. coli O157, and norovirus. Polymorphisms in genes encoding inflammatory mediators have been associated with the outcome of infection with enteroaggregative E. coli, enterotoxin-producing E. coli, Salmonella, C. difficile, and V. cholerae.\n\nAPPROACH TO THE PATIENT:\n\nThe approach to the patient with possible infectious diarrhea or bacterial food poisoning is shown in Fig. 160-1.', 'After adherence of ETEC via colonization factors (e.g., CFA/I, CS1-6), disease is mediated primarily by a heat-labile toxin (LT-1) and/ or a heat-stable toxin (STa) that causes net fluid secretion via activation of adenylate cyclase (LT-1) and/or guanylate cyclase (STa) in the jejunum and ileum. The result is watery diarrhea accompanied by cramps. LT-1 consists of an A and a B subunit and is structurally and functionally similar to cholera toxin. Strong binding of the B subunit to the GM1 ganglioside on intestinal epithelial cells leads to the intracellular translocation of the A subunit, which functions as an ADPribosyltransferase. Mature STa is an 18or 19-amino-acid secreted peptide whose biologic activity is mediated by binding to the guanylate cyclase C found in the brush-border membrane of enterocytes and results in increased intracellular concentrations of cyclic GMP. Characteristically absent in ETEC-mediated disease are histopathologic changes within the small bowel; mucus, blood, and inflammatory cells in stool; and fever. The disease spectrum ranges from a mild illness to a life-threatening cholera-like syndrome. Although symptoms are usually self-limited (typically lasting for 3 days), infection may result in significant morbidity and mortality (mostly from profound volume depletion) when access to health care or suitable rehydration fluids is limited and when small and/or undernourished children are affected.', 'V. cholerae O139 is probably derived from an El Tor O1 strain that acquired the genes for O139 O-antigen synthesis by horizontal gene transfer.\n\nIndividuals infected with V. cholerae O1 or O139 exhibit a range of clinical manifestations. Some individuals are asymptomatic or have only mild diarrhea; others present with the sudden onset of explosive and life-threatening diarrhea (cholera gravis). The reasons for the range in signs and symptoms of disease are incompletely understood but include the level of preexisting immunity, blood type, and nutritional status. In a nonimmune individual, after a 24to 48-h incubation period, cholera characteristically begins with the sudden onset of painless watery diarrhea that may quickly become voluminous. Patients often vomit. In severe cases, volume loss can exceed 250 mL/ kg in the first 24 h. If fluids and electrolytes are not replaced, hypovolemic shock and death may ensue. Fever is usually absent. Muscle cramps due to electrolyte disturbances are common. The stool has a characteristic appearance: a nonbilious, gray, slightly cloudy fluid with flecks of mucus, no blood, and a somewhat fishy, inoffensive odor. It has been called “rice-water” stool because of its resemblance to the water in which rice has been washed (Fig. 193-2). Clinical symptoms', 'The V. cholerae genome comprises two circular chromosomes.\n\nLateral gene transfer has played a key role in the evolution of epidemic V. cholerae. The genes encoding cholera toxin (ctxAB) are part of the genome of a bacteriophage, CTXФ. The receptor for this phage on the V. cholerae surface is the intestinal colonization factor TCP. Because ctxAB is part of a mobile genetic element (CTXФ), horizontal transfer of this bacteriophage may account for the emergence of new toxigenic V. cholerae serogroups. Many of the other genes important for V. cholerae pathogenicity, including the genes encoding the biosynthesis of TCP, those encoding accessory colonization factors, and those regulating virulence gene expression, are clustered together in the V. cholerae pathogenicity island. Similar clustering of virulence genes is found in other bacterial pathogens. It is believed that pathogenicity islands are acquired by horizontal gene transfer.\n\nV. cholerae O139 is probably derived from an El Tor O1 strain that acquired the genes for O139 O-antigen synthesis by horizontal gene transfer.', 'Nelson EJ, Harris JB, Morris JG Jr et al. (2009) Cholera transmission: the host, pathogen and bacteriophage dynamic. Nat. Rev. Microbiol. 7, 693–702.\n\nPflughoeft KJ & Versalovic J (2012) Human microbiome in health and disease. Annu. Rev. Pathol. 7, 99–122.\n\nPolk DB & Peek RM Jr (2010) Helicobacter pylori: gastric cancer and beyond. Nat. Rev. Cancer 10, 403–414.\n\nPoulin R & Morand S (2000) The diversity of parasites. Q. Rev. Biol. 75, 277–293.\n\nRappleye CA & Goldman WE (2006) Defining virulence genes in the dimorphic fungi. Annu. Rev. Microbiol. 60, 281–303.\n\nThomas CM & Nielsen KM (2005) Mechanisms of, and barriers to, horizontal gene transfer between bacteria. Nat. Rev. Microbiol. 3, 711–721.\n\nVotteler J & Sundquist WI (2013) Virus budding and the ESCRT pathway. Cell Host Microbe 14, 232–241.\n\nYoung JAT & Collier RJ (2007) Anthrax toxin: receptor binding, internalization, pore formation, and translocation. Annu. Rev. Biochem. 76, 243–265.\n\nCell Biology of Infection\n\nAlix E, Mukherjee S & Roy CR (2011) Subversion of membrane transport pathways by vacuolar pathogens. J. Cell Biol. 195, 943–952.', 'bacterial pathogens, virulence genes often encode secreted toxic proteins (toxins) that interact with host cell structural or signaling proteins to elicit a response that is beneficial to the pathogen. Several of these bacterial toxins are among the most potent of known human poisons. Bacterial toxins are often composed of two protein components—an A subunit with enzymatic activity, and a B subunit that binds to specific receptors on the host cell surface and directs the trafficking of the A subunit to the cytosol by various routes (Figure 23–6). The Vibrio cholerae phage, for example, encodes the two subunits of cholera toxin (Movie 23.2). The A subunit catalyzes the transfer of an ADP-ribose moiety from NAD+ to the trimeric G protein Gs (see Figure 15–23), which activates adenylyl cyclase to make cyclic AMP (see Figure 15–25). ADP-ribosylation prevents inactivation of the G protein and results in the overaccumulation of intracellular cyclic AMP and the release of ions and water into the intestinal lumen, leading to the watery diarrhea associated with cholera. The infection then spreads to new hosts via released bacteria, which can contaminate food and water.', 'Sporadic endemic infections due to V. cholerae O1 strains related to the seventh-pandemic strain have been recognized along the U.S. Gulf Coast of Louisiana and Texas. These infections are typically associated with the consumption of contaminated, locally harvested shellfish. Occasionally, cases in U.S. locations remote from the Gulf Coast have been linked to shipped-in Gulf Coast seafood.\n\nIn October 1992, a large-scale outbreak of clinical cholera caused by a new serogroup, O139, occurred in southeastern India. The organism appears to be a derivative of El Tor O1 but has a distinct LPS and an immunologically related O-antigen polysaccharide capsule. (O1 organisms are not encapsulated.) After an initial spread across 11 Asian countries, V. cholerae O139 has once again been almost entirely replaced by O1 strains. The clinical manifestations of disease caused by V. cholerae O139 are indistinguishable from those of O1 cholera. Immunity to one, however, is not protective against the other.\n\nIn the final analysis, cholera is a toxin-mediated disease. The watery diarrhea characteristic of cholera is due to the action of cholera toxin, a potent protein enterotoxin elaborated by the organism in the small intestine. The toxin-coregulated pilus (TCP), so named because its synthesis is regulated in parallel with that of cholera toxin, is essential for V. cholerae to survive and multiply in (colonize) the small intestine. Cholera toxin, TCP, and several other virulence factors are coordinately regulated by ToxR. This protein modulates the expression of genes coding for virulence factors in response to environmental signals via a cascade of regulatory proteins. Additional regulatory processes, including bacterial responses to the density of the bacterial population (in a phenomenon known as quorum sensing), modulate the virulence of\n\nV. cholerae.', 'Acquisition of genes and gene clusters can drive the rapid evolution of pathogens and turn nonpathogens into pathogens. Consider, for example, Vibrio cholerae—the Gram-negative bacterium that causes the epidemic diarrheal disease cholera. Of the hundreds of strains of Vibrio cholerae, the only ones that cause pandemic human disease are those infected with a mobile bacteriophage (CTXϕ) containing genes encoding the two subunits of the toxin that causes the diarrhea. As summarized in Figure 23–5, seven pandemics of V. cholerae have arisen since 1817. The first six were caused by the periodic reemergence of so-called Classical strains. In addition to the toxin-encoding bacteriophage, these Classical strains shared a similar O1 surface antigen, part of the LPS in the outer membrane (see Figure 23–3C). In 1961, the seventh pandemic began, caused by a new strain named “El Tor,” which arose when an O1-expressing strain acquired two bacteriophages and at least two new pathogenicity islands. El Tor eventually displaced the Classical strains. In 1992, a new strain emerged in which O1 was replaced with another O-antigen variant called O139, which was not recognized by antibodies present in the blood of survivors of previous cholera epidemics. The O139 strain also contains a transposon-like element that encodes antibiotic resistance. As this example makes clear, the rapid evolution of bacterial pathogens can be likened to an arms race which pits the survival of a bacterium against our immune systems and the tools of modern medicine. Similar struggles for survival take place between all pathogens and humans, and understanding these conflicts provides key insights into the evolution of pathogens and greatly informs us how we treat new outbreaks of infectious diseases.\n\nBacterial Virulence Genes Encode Effector Proteins and Secretion Systems to Deliver Effector Proteins to Host Cells', '(B) Bacterial pathogens evolve by horizontal gene transfer. This can occur by three mechanisms: natural transformation, in which naked DNA is taken in by competent bacteria; transduction, in which bacterial viruses (bacteriophages) transfer DNA from one bacterium into another; and conjugation, during which plasmid DNA, and even chromosomal DNA, is transferred from a donor to a recipient bacterium.\n\nV.cholerae\n\nV. cholerae O1 serogroup V. cholerae O1 serogroup Classical V. cholerae O139 serogroup VSP1 VSP2 CTX˜Classical CTX˜El Tor RS1˜O139 antigen SXT 1st through 6th pandemics 7th pandemic\n\nV.cholerae variation is astonishing; the genomes of different strains of Escherichia coli can differ by as much as 25%. Such variation has led to the concept that a bacterial species has both a core genome common to all isolates within the species and a larger pan-genome consisting of all genes present in the full spectrum of isolates.', 'Pathogenic bacteria are thought to emerge when groups of virulence genes are transferred together into a previously avirulent bacterium by a process called horizontal gene transfer (to distinguish it from vertical gene transfer from parent to offspring). Horizontal transfer can occur by one of three mechanisms: natural transformation by released naked DNA, transduction by bacteriophages, or sexual exchange by conjugation (Figure 23–4B and Movie 23.1). Sequencing the genomes of large numbers of pathogenic and nonpathogenic bacteria has indicated that horizontal gene transfer has made important contributions to bacterial evolution, enabling species to inhabit new ecological and nutritional niches, as well as to cause disease. Even within a single bacterial species, the amount of chromosomal\n\nE. coli Shigella fexneri Salmonella enterica\n\nFigure 23–4 Genetic differences between pathogenic and nonpathogenic bacteria. (A) Genetic differences between nonpathogenic E. coli and two closely related food-borne pathogens—Shigella flexneri, which causes dysentery, and Salmonella enterica, a common cause of food poisoning. Nonpathogenic E.\xa0coli has a single circular chromosome. The chromosome of S. flexneri differs from that of E. coli in a limited number of locations; most of the genes required for pathogenesis (virulence genes) are carried on an extrachromosomal virulence plasmid. The chromosome of S. enterica carries two large inserts (pathogenicity islands) not found in the E. coli chromosome; these inserts each contain many virulence genes.']",Transduction,Transduction,1.0,0.29939393938795156,0.75,0.8928571428571428,0.601453594026976,golden_010,C,C,True,True
"A 19-year-old woman presents to her gynecologist’s office stating that she has never had a period. She is slightly alarmed because most of her friends in college have been menstruating for years. She is also concerned about her short stature. When she previously visited her family physician during early puberty, she was told that she will gain the appropriate height during her final teenage years. However, over the past few years, she has gained only a couple of inches. On examination, she has a wide chest and short neck. Her breast development is at Tanner stage 1. Her external genitalia is normal with sparse hair distribution over the mons pubis. Her gynecologist suspects a genetic condition and sends her for genetic counseling. Based on her clinical findings, which of the following diseases is she most likely to develop?","['Figure 29.13 Right A: A 16-year-old girl with delayed puberty. Breast budding began at 11 years of age, but there was no further development. During the year before presentation, her scholastic performance in school deteriorated, she gained 25 lb, she became increasingly lethargic, and nocturia and polydypsia were noted. Initial evaluation documented low follicle-stimulating hormone, elevated prolactin, and a bone age of 10.5 years. Computed tomography scanning documented a large hypothalamic neoplasm that proved to be an ectopic germinoma. The patient was also documented to be hypothyroid and hypoadrenal and to have diabetes insipidus. Despite the elevated prolactin, she had no galactorrhea because of the minimal breast development. (From Rebar RW. Normal and abnormal sexual differentiation and pubertal development. In: Moore TR, Reiter RC, Rebar RW, et al., eds. Gynecology and obstetrics: a longitudinal approach. New York: Churchill Livingstone, 1993:97–133, with permission.)\n\nSevere chronic illnesses, often accompanied by malnutrition, may lead to slowed growth in childhood and delayed adolescence. Regardless of the cause, weight loss to less than 80% to 85% of ideal body weight often results in hypothalamic GnRH deficiency. If adequate body weight and nutrition are maintained in chronic illnesses such as Crohn disease or chronic pulmonary or renal disease, sufficient gonadotropin secretion usually is present to initiate and maintain pubertal development.\n\nAnorexia Nervosa and Bulimia Significant weight loss and psychological dysfunction occur simultaneously with anorexia nervosa (60,61). Although many anorectic girls experience amenorrhea after pubertal development begins, if the disorder begins sufficiently early,', 'Girls with ambiguous genitalia may require reconstructive surgery, including clitoral recession and vaginoplasty. Timing of such surgery is debated, but the girl must be of appropriate size to ensure the surgery is as simple as possible.\n\nThe most common cause of heterosexual development at the expected age of puberty is PCOS (Fig. 29.21). Because the syndrome is heterogeneous and poorly defined, clinical difficulties result in diagnosis and management (90). For the sake of simplicity, PCOS may be defined as LH-dependent hyperandrogenism (91). The Rotterdam criteria are commonly used to identify individuals with PCOS and require the presence of at least two of the following: oligoor anovulation, clinical and/or biochemical signs of hyperandrogenism, and polycystic ovaries, with exclusion of other etiologies (CAH, androgen-secreting tumors, Cushing syndrome) (92). Polycystic ovaries ultrasonically are defined as the presence of 12 or more follicles in each ovary measuring 2 to 9 mm in diameter and/or increased ovarian volume (>10 mL). Most clinical manifestations arise as a consequence of the hyperandrogenism and often include hirsutism beginning at or near puberty and irregular menses from the age of menarche because of oligoovulation or anovulation. Clinical manifestations are as follows: 1.\n\nAffected girls may be but are not necessarily somewhat overweight.\n\n2.\n\nIn rare instances, menarche may be delayed, and primary amenorrhea may occur.\n\n3.\n\nBasal levels of LH tend to be elevated in most affected individuals, and androgen production is invariably increased, even though circulating levels of androgens may be near the upper limits of the normal range in many affected women.\n\nFigure 29.21 Typical facial hirsutism in three women with polycystic ovarian syndrome. A: 25-year-old.', 'Available @ StudentConsult.com\n\nIn addition to other diagnoses mentioned, other conditionsneed to be considered when evaluating girls with lack ofmenses. The Mayer-Rokitansky-Kuster-Hauser syndrome ofcongenital absence of the uterus occurs in 1 in 4000 to 5000female births. Anatomic obstruction by imperforate hymen orvaginal septum also presents with normal secondary sexualdevelopment without menstruation. The complete syndromeof androgen insensitivity includes normal feminization, absence of pubic or axillary hair, and primary amenorrhea.In this syndrome, all müllerian structures, including ovaries, uterus, fallopian tubes, and upper third of the vagina, are lacking; the karyotype is 46,XY, and subjects have intra-abdominal testes.\n\nWhen no secondary sexual development is present after the upper age limits of normal pubertal development, serum gonadotropin levels should be obtained to determine whether the patient has a hypogonadotropic or hypergonadotropic hypogonadism (see Table 174-2). Based on gonadotropin measurements only, the differentiation between constitutional delay in growth and hypogonadotropic hypogonadism is difficult; the gonadotropin levels are low in both conditions. Sometimes observation for months or years is necessary before the diagnosis is confirmed. Ultrasound of the pelvic structures in females would be helpful in the workup of delayed puberty.', 'Fig. 7.16 ClinicalfeaturesandkaryotypesofTurnersyndrome.\n\nto develop normal secondary sex characteristics; the genitalia remain infantile, breast development is minimal, and little pubic hair appears. Most patients have primary amenorrhea, and morphologic examination shows transformation of the ovaries into white streaks of fibrous stroma devoid of follicles. The mental status of these patients usually is normal, but subtle defects in visual–spatial information processing have been noted. Curiously, hypothyroidism caused by autoantibodies occurs, especially in women with isochromosome Xp. As many as 50% of these patients develop clinical hypothyroidism. In adult patients, a combination of short stature and primary amenorrhea should prompt strong suspicion for Turner syndrome. The diagnosis is established by karyotyping.\n\nApproximately 43% of patients with Turner syndrome either are mosaics (one of the cell lines being 45,X) or have structural abnormalities of the X chromosome. The most common is deletion of the short arm, resulting in the formation of an isochromosome of the long arm, 46,X,i(X) (q10). The net effect of the associated structural abnormalities is to produce partial monosomy of the X chromosome. Combinations of deletions and mosaicism also occur. It is important to appreciate the karyotypic heterogeneity associated with Turner syndrome because it is responsible for significant variations in the phenotype. In contrast with the patients with monosomy X, those who are mosaics or have deletion variants may have an almost normal appearance and may present only with primary amenorrhea.', 'Delayed Puberty Delayed puberty (Table 412-4) is defined as the absence of secondary sexual characteristics by age 13 in girls. The diagnostic considerations are very similar to those for primary amenorrhea (Chap. 69). Between 25 and 40% of delayed puberty in girls is of ovarian origin, with Turner’s syndrome accounting for the majority of such patients. Functional hypogonadotropic hypogonadism encompasses diverse etiologies such as systemic illnesses, including celiac disease and chronic renal disease, and endocrinopathies such as diabetes and hypothyroidism. In addition, girls appear to be particularly susceptible to the adverse effects of decreased energy balance resulting from exercise, dieting, and/or eating disorders. Together these reversible conditions account for ~25% of delayed puberty in girls. Congenital hypogonadotropic hypogonadism in girls or boys can be caused by mutations in several different genes or combinations of genes (Fig. 412-4, Chap. 411, Table 411-2). Approximately 50% of girls with congenital hypogonadotropic hypogonadism, with or without anosmia, have a history of some degree of breast development, and 10% report one to two episodes of vaginal bleeding. Family studies suggest that genes identified in association with absent puberty may also cause delayed puberty, and recent reports have further suggested that a genetic susceptibility to environmental stresses such as diet and exercise may account for at least some cases of functional hypothalamic amenorrhea. Although neuroanatomic causes of delayed puberty are considerably less common in girls than in boys, it is always important to rule these out in the setting of hypogonadotropic hypogonadism.', '. Turner syndrome is characterized by a karyotype of 45XO or by a mosaic karyotypeand clinically presents with short stature, shield chest, wide-spaced nipples, wide-carrying angle of the upper extremities,high-arched palate, gonadal failure, kidney dysplasias with normal function, and aortic arch abnormalities. Affected girlsare often susceptible to autoimmune disorders.', 'Turner syndrome, characterized by primary hypogonadism in phenotypic females, results from partial or http://ebooksmedicine.net complete monosomy of the short arm of the X chromosome. With routine cytogenetic methods, the entire X chromosome is found to be missing in 57% of patients, resulting in a 45,X karyotype. These patients are the most severely affected, and the diagnosis often can be made at birth or early in childhood. Typical clinical features associated with 45,X Turner syndrome include growth retardation, leading to abnormally short stature (below the third percentile); swelling of the nape of the neck because of distended lymphatic channels (in infancy) that is seen as webbing of the neck in older children; low posterior hairline; cubitus valgus (an increase in the carrying angle of the arms); shieldlike chest with widely spaced nipples; high-arched palate; lymphedema of the hands and feet; and a variety of congenital malformations such as horseshoe kidney, bicuspid aortic valve, and coarctation of the aorta (\n\nFig. 7.16 ). Cardiovascular abnormalities are the most common cause of death in childhood. In adolescence, affected girls fail\n\nCoarctation of aorta Broad chest\n\nStreak ovaries, infertility, amenorrhea\n\nIncidence: 1 in 3000 female births Karyotypes: Classic: 45,X Defective second X chromosome: 46,X,i(Xq) 46,XXq– 46,XXp– 46,X, r(X) Mosaic type: 45,X/46,XX\n\nFig. 7.16 ClinicalfeaturesandkaryotypesofTurnersyndrome.', 'Clinical Features TS is characterized by bilateral streak gonads, primary amenorrhea, short stature, and multiple congenital anomalies in phenotypic females. It affects ~1 in 2500 women and is diagnosed at different ages depending on the dominant clinical features (Table 410-2). Prenatally, a diagnosis of TS usually is made incidentally after chorionic villus sampling or amniocentesis for unrelated reasons such as advanced maternal age. Prenatal ultrasound findings include increased nuchal translucency. The postnatal diagnosis of TS should be considered in female neonates or infants with lymphedema, nuchal folds, low hairline, or left-sided cardiac defects and in girls with unexplained growth failure or pubertal delay. Although limited spontaneous pubertal development occurs in up to 30% of girls with TS (10%, 45,X; 30–40%, 45,X/46,XX) and ~2% reach menarche, the vast majority of women with TS develop complete ovarian insufficiency. Therefore, this diagnosis should be considered in all women who present with primary or secondary amenorrhea and elevated gonadotropin levels.\n\nThe management of girls and women with TS requires a multidisciplinary approach because of the number of potentially involved organ systems. Detailed cardiac and renal evaluation should be performed at the time of diagnosis. Individuals with congenital heart\n\nDisorders of Sex Development\n\nKlinefelter’s syndrome 47,XXY or 46,XY/47,XXY Hyalinized testes Male Male Gynecomastia', 'Abnormalities associated with Turner syndrome include left sided cardiac defects-such as coarctation of the aorta, hypo plastic left heart syndrome, or bicuspid aortic valve-in 30 to 50 percent; renal anomalies, particularly horseshoe kidney; and hypothyroidism. Other features are short stature, broad chest with widely spaced nipples, congenital lymphedema-pui ness over the dorsum of hands and feet, and a ""webbed"" pos terior neck resulting from cystic hygromas. Intelligence scores are generally in the normal range, but afected individuals are at risk for diiculties with visual-spatial organization, nonver bal problem solving, and interpretation of social cues Q ones, 2006). Growth hormone is typically administered in childhood to ameliorate short stature (Kappelgaard, 201i1). More than 90 starting just before adolescence. An exception is mosaicism involving the Y chromosome, as this confers risk for germ cell neoplasm-regardless of whether the child is phenotypically male or female. Accordingly, eventual prophylactic bilateral gonadectomy is indicated (Cools, 2011; Schorge, 2016).', '39.\n\nBremer GL, Land JA, Tiebosch A, et al. Five different histological subtypes of germ cell malignancies in an XY female. Gynecol Oncol 1993;50:247–248.\n\n40.\n\nKarnis MF, Zimon AE, Lalwani SI, et al. Risk of death in pregnancy achieved through oocyte donation in patients with Turner syndrome: a national survey. Fertil Steril 2003;80:498–501.\n\n41.\n\nMatura LA, Ho VB, Rosing DR, et al. Aortic dilatation and dissection in Turner syndrome. Circulation 2007; 116:1663– 1670.\n\n42.\n\nRosenfeld RG, Frane J, Attie KM, et al. Six-year results of a randomized prospective trial of human growth hormone and oxandrolone in Turner syndrome. J Pediatr 1992;121:49–55.\n\n43.\n\nSas TC, de Muinck Keizer-Schrama S, Stijnen T, et al. Normalization of height in girls with Turner syndrome after long-term growth hormone treatment: results of a randomized dose-response trial. J Clin Endocrinol Metab 1999;84:4607–4612.\n\n44.\n\nSas TC, Gerver WJ, De Bruin R, et al. Body proportions during long-term growth hormone treatment in girls with Turner syndrome participating in a randomized dose-response trial. J Clin Endocrinol Metab 1999;84:4622–4628.\n\n45.\n\nRosenfeld RG, Attie KM, Frane J, et al. Growth hormone therapy of Turner’s syndrome: beneficial effect on adult height. J Pediatr 1998;132:319–324.\n\n46.', '45.\n\nRosenfeld RG, Attie KM, Frane J, et al. Growth hormone therapy of Turner’s syndrome: beneficial effect on adult height. J Pediatr 1998;132:319–324.\n\n46.\n\nChernausek SD, Attie KM, Cara JF, et al. Growth hormone therapy of Turner syndrome: the impact of age of estrogen replacement on final height. Genentech, Inc., Collaborative Study Group. J Clin Endocrinol Metab 2000;85:2439–2445.\n\n47.\n\nHogler W, Briody J, Moore B, et al. Importance of estrogen on bone health in Turner syndrome: a cross-sectional and longitudinal study using dual-energy x-ray absorptiometry. J Clin Endocrinol Metab 2004;89:193–199.\n\n48.\n\nRebar RW, Cedars MI. Hypergonadotropic amenorrhea. In: Filicori M, Flamigni C, eds. Ovulation induction: basic science and clinical advances. Amsterdam, Netherlands: Elsevier Science B.V., 1994:115–121.\n\n49.\n\nKustin J, Rebar RW. Hirsutism in young adolescent girls. Pediatr Ann 1986;15:522.\n\n50.\n\nAchermann JC, Jameson JL. Advances in the molecular genetics of hypogonadotropic hypogonadism. J Pediatr Endocrinol Metab 2001;14:3–15.\n\n51.\n\nHerbison AE. Genetics of puberty. Horm Res 2007;68:75–79.\n\n52.\n\nKallmann FJ, Schoenfeld WA, Barrera SE. The genetic aspects of primary eunuchoidism. Am J Ment Defic 1944;48:203–236.\n\n53.', '33.\n\nButtram VC Jr, Reiter RC. Surgical treatment of the infertile female. Baltimore, MD: Williams & Wilkins, 1985:89.\n\n34.\n\nPellerito JS, McCarthy SM, Doyle MB, et al. Diagnosis of uterine anomalies: relative accuracy of MR imaging, endovaginal sonography, and hysterosalpingography. Radiology 1992;183:795–800.\n\n35.\n\nSimpson JL. Localizing ovarian determinants through phenotypickaryotypic deductions: progress and pitfalls. In: Rosenfield R, Grumbach M, eds. Turner syndrome. New York: Marcel Dekker, 1990:65–77.\n\n36.\n\nVan Dyke DL, Wiktor A, Palmer CG, et al. Ullrich-Turner syndrome with a small ring X chromosome and the presence of mental retardation. Am J Med Genet 1992;43:996–1005.\n\n37.\n\nEllison JW, Wardak Z, Young MF, et al. PHOG, a candidate gene for involvement in the short stature of Turner syndrome. Hum Mol Genet 1997;6:1341–1347.\n\n38.\n\nCools M, Drop SL, Wolffenbuttel KP, et al. Germ cell tumors in the intersex gonad: old paths, new directions, moving frontiers. Endocr Rev 2006;27:468–484.\n\n39.\n\nBremer GL, Land JA, Tiebosch A, et al. Five different histological subtypes of germ cell malignancies in an XY female. Gynecol Oncol 1993;50:247–248.\n\n40.', 'The diagnostic workup is summarized as follows: 1.\n\nThe initial laboratory test should be assessment of serum FSH and LH levels unless the history and physical examination suggest otherwise in order to differentiate hypergonadotropic and hypogonadotropic forms of hypogonadism. If the FSH level is elevated, a karyotype should be obtained. An elevated FSH level in combination with a 45,X karyotype confirms the diagnosis of Turner syndrome. Partial deletion of the X chromosome, mosaicism, pure gonadal dysgenesis, and mixed gonadal dysgenesis are diagnosed by obtaining a karyotype.\n\n2.\n\nBecause of the association with coarctation of the aorta (up to 30%) and thyroid dysfunction, patients with Turner syndrome should undergo echocardiography every 3 to 5 years and thyroid function studies yearly. Cardiac MRI is considered an important component of the cardiac evaluation (6). Patients with Turner syndrome should be evaluated for hearing loss, renal malformations, diabetes, and hypertension.\n\n3.\n\nIf the karyotype is abnormal and contains the Y chromosome, as in gonadal dysgenesis, the gonads should be removed to prevent tumors (13).\n\n4.\n\nIf the karyotype is normal and the FSH level is elevated, it is important to consider the diagnosis of 17-hydroxylase deficiency because it may be a life-threatening disease if untreated. This diagnosis should be considered when testing indicates elevated serum progesterone (>3.0 ng/mL) level, a low 17α-hydroxyprogesterone (0.2 ng/mL) level, and an elevated serum deoxycorticosterone level (52). The diagnosis is confirmed with an ACTH stimulation test. After ACTH bolus administration, affected individuals have markedly increased levels of serum progesterone compared with baseline levels and no change in serum 17α-hydroxyprogesterone levels.', 'Tepperberg J, Pettenati MJ, Rao PN, et al: Prenatal diagnosis using interphase fluorescence in situ hybridization (FISH): 2-year multi-center retrospective study and review of the literature. Prenat Diagn 21(4):293,o2001\n\nTinkle BT, Walker ME, Blough-Pfau I, et al: Unexpected survival in a case of prenatally diagnosed non-mosaic trisomy 22: clinical report and review of the natural history. Am J Med Genet A 118A(1):90, 2003\n\nToriello HV, Meck JM, Professional Practice and Guidelines Committee:\n\nStatement on guidance for genetic counseling in advanced paternal age. Genet Med 10(6):457, 2008\n\nTuohy JF, James DK: Pre-eclampsia and trisomy 13. BJOG 99(11):891, 1992 Turner HH: A syndrome of infantilism, congenital webbed neck and cubitus valgus. Endocrinol 23:566, 1938\n\nVendola e, Canfield M, Daiger SP, et al: Survival of Texas infants born with trisomies 21, 18, and 13. Am J Med Genet A 152A(2):360, 2010 Vintzileos Ni, Egan JF: Adjusting the risk for trisomy 21 on the basis of second-trimester ultrasonography. Am J Obstet GynecoIo172(3):837, 1995\n\nVockley J, ndersson He, Antshel KM, et al: ACMG Practice Guidelines: phenylalanine hydroxylase deficiency: diagnosis and management guideline. Genet Med 16(2):188,o2014']",Coarctation of aorta,Coarctation of aorta,1.0,0.3312881562815305,0.0,0.6250000000000001,0.5524217980292041,golden_011,B,B,True,True
